publishedAt,title,description,url,source
2025-06-11T19:54:22Z,Liquid Glass software interface: Get to know Apple’s new design language,"The worst-kept secret just dropped at WWDC—say hello to Apple’s Liquid Glass software interface. This shiny new design will now stretch across all Apple gadgets, giving everything a unified, smooth look. Some say Apple’s trying to shift the spotlight away fro…",https://thegadgetflow.com/blog/liquid-glass-software-interface-meet-apples-new-design-language/,"{'id': None, 'name': 'Gadget Flow'}"
2025-06-11T19:53:39Z,"These old iPhones, Macs, and iPads won't run Apple's latest updates - did yours make the cut?","Apple just announced a slew of attention-grabbing software updates, but not all devices are supported.",https://www.zdnet.com/article/these-old-iphones-macs-and-ipads-wont-run-apples-latest-updates-did-yours-make-the-cut/,"{'id': None, 'name': 'ZDNet'}"
2025-06-11T19:52:20Z,Steve Jobs Would 'Have Fired Everyone': Apple's Liquid Glass In iOS 26 Gets Roasted Online — Dan Ives Calls WWDC 2025 A 'Yawner' - Yahoo Finance,Steve Jobs Would 'Have Fired Everyone': Apple's Liquid Glass In iOS 26 Gets Roasted Online — Dan Ives Calls WWDC 2025 A 'Yawner'Yahoo Finance ‘Classic Apple': Why Apple is taking the slow road with AIYahoo Finance Apple Just Showed Off a New Look for iPhones.…,https://slashdot.org/firehose.pl?op=view&amp;id=178010767,"{'id': None, 'name': 'Slashdot.org'}"
2025-06-11T19:49:11Z,Apple made a haptic ‘F1’ trailer that you need to feel to believe,"Macworld







After peppering its WWDC keynote with numerous “F1” references, it’s clear that Apple is going all out to promote its upcoming Brad Pitt flick. The latest move to drum up hype is a new trailer ahead of its June 27 release–but it not just for …",https://www.macworld.com/article/2812246/apple-made-a-haptic-f1-trailer-that-you-need-to-feel-to-believe.html,"{'id': None, 'name': 'Macworld'}"
2025-06-11T19:48:17Z,Apple quietly launches Container on GitHub to bring Linux development to macOS i,"Apple has released a new developer tool on GitHub called Container, offering a fresh approach to running Linux containers directly on macOS. Unlike Docker or Podman, this tool is designed to feel at home in the Apple ecosystem and hooks into frameworks alread…",https://slashdot.org/submission/17336855/apple-quietly-launches-container-on-github-to-bring-linux-development-to-macos-i,"{'id': None, 'name': 'Slashdot.org'}"
2025-06-11T19:44:48Z,"Liquid Glass on iOS 26 is stunning, it also sucks","Apple put so much thought into whether it could, that it didn't stop to think whether it should.",https://www.phonearena.com/news/liquid-glass-ios-26-is-stunning-it-also-sucks_id171251,"{'id': None, 'name': 'PhoneArena'}"
2025-06-11T19:43:51Z,Markdown and Menu Bars: How Apple Notes on iPadOS 26 has matured,"Apple Notes on iPadOS 26 is now even more powerful, thanks to the addition of transcripts of call recordings, exporting as a markdown file, and the new menubar.The new Apple Notes in iPadOS 26Apple's Notes app has been an invaluable tool for writing text and …",https://appleinsider.com/articles/25/06/11/markdown-and-menu-bars-how-apple-notes-on-ipados-26-has-matured,"{'id': None, 'name': 'AppleInsider'}"
2025-06-11T19:43:32Z,Apple leads megacap losses,"A selloff in major tech stocks pulled markets lower, ending a three-day rally that had brought the S&P 500 close to its record highs…
The post Apple leads megacap losses appeared first on MacDailyNews.",https://macdailynews.com/2025/06/11/apple-leads-megacap-losses/,"{'id': None, 'name': 'Macdailynews.com'}"
2025-06-11T19:43:05Z,2014 Porsche Cayenne Diesel,"This 2014 Porsche Cayenne Diesel spent time in Ohio, Florida, and Oregon before the seller purchased it as a Porsche Approved Certified Pre-Owned example in March 2024. The Black-over-Black SUV has 65k miles and is powered by a 3.0-liter turbodiesel V6 linked…",https://bringatrailer.com/listing/2014-porsche-cayenne-diesel-90/,"{'id': None, 'name': 'Bringatrailer.com'}"
2025-06-11T19:39:00Z,All of the new features coming to Apple’s iOS apps,"These include significant updates like Call Screening, more travel-friendly features in Wallet, and highly-requested group chat features in Messages.",https://techcrunch.com/2025/06/11/all-of-the-new-features-coming-to-apples-ios-apps/,"{'id': 'techcrunch', 'name': 'TechCrunch'}"
2025-06-11T19:38:28Z,"Kevin Durant trade rumors: Knicks not in pursuit of NBA superstar despite Suns hearing offers, per report",New York is coming off its first Eastern Conference Finals appearance in 25 years,https://www.cbssports.com/nba/news/kevin-durant-trade-rumors-knicks-not-in-pursuit-of-nba-superstar-despite-suns-hearing-offers-per-report/,"{'id': None, 'name': 'CBS Sports'}"
2025-06-11T19:36:08Z,Brian Wilson Was A Foundational Influence On Modern Music,"Getty Image/Derrick Rossignol

The rock legend has died at the age of 82.",https://uproxx.com/indie/brian-wilson-influence-music-obituary/,"{'id': None, 'name': 'UPROXX'}"
2025-06-11T19:35:10Z,Apple's AI Future In Question? Stock Falls After WWDC 2025 Event,"Apple Inc (NASADQ: AAPL) shares are trading lower Wednesday afternoon as investors continue to digest announcements from this week’s Worldwide Developers Conference. 
What To Know: The much-anticipated event showcased updates across Apple’s operating systems,…",https://biztoc.com/x/1dccee34dd5984b0,"{'id': None, 'name': 'Biztoc.com'}"
2025-06-11T19:33:24Z,TSA warns passengers of little-known food and drink rules at security checkpoints as summer travel hits high gear,Some of the allowed items might surprise you.,https://nypost.com/2025/06/11/lifestyle/tsa-warns-passengers-of-little-known-food-and-drink-rules/,"{'id': None, 'name': 'New York Post'}"
2025-06-11T19:32:55Z,Jim Cramer Notes “It’s Been Hard to Own Apple Lately”,,https://consent.yahoo.com/v2/collectConsent?sessionId=1_cc-session_ee3174f3-e87b-42c8-b52d-9844858fbbf3,"{'id': None, 'name': 'Yahoo Entertainment'}"
2025-06-11T19:31:10Z,Apple Release New Linux Container Tool for macOS,"Apple is having a busy WWDC, but beyond the gossip over its new glassy OS UI came a new tool which anyone using a Mac to work with Linux containers will be interested in hearing about. This week Apple released an initial build of its new open-source container…",https://www.omgubuntu.co.uk/2025/06/apple-linux-container-tool-mac-developers,"{'id': None, 'name': 'Omgubuntu.co.uk'}"
2025-06-11T19:22:12Z,Apple Card accused of gender discrimination in its algorithm,"Apple Card accused of gender discrimination in its algorithm
One of Apple's co-founders, Steve Wozniak, is accusing the company's new digital credit card of gender discrimination. Apple introduced the card in August, partnering with Goldman Sachs as the issui…",https://biztoc.com/x/61a3412056e806ae,"{'id': None, 'name': 'Biztoc.com'}"
2025-06-11T19:13:11Z,Apple executives say new AI-powered Siri wasn’t ‘demoware’ — it just wasn’t ready to ship - TechCrunch,"Apple executives say new AI-powered Siri wasn’t ‘demoware’ — it just wasn’t ready to shipTechCrunch Apple Executives Defend Apple Intelligence, Siri and AI StrategyWSJ Apple Knows AI Isn’t What People Really Want, but It Can’t Say ThatGizmodo Apple’s WWDC was…",https://slashdot.org/firehose.pl?op=view&amp;id=178010525,"{'id': None, 'name': 'Slashdot.org'}"
2025-06-11T19:10:42Z,Air vs. liquid cooling for CPUs: We debated it with Gear Seekers,"You need to cool your PC’s processor no matter what, but you can do so in different ways—with a heatsink and one or more fans for old-school air cooling, or with an AIO liquid-cooled setup as seems to be the trend for any high-end PC setup. But which is bette…",https://www.pcworld.com/article/2812183/air-vs-liquid-cooling-for-cpus-we-debated-it-with-gear-seekers.html,"{'id': None, 'name': 'PCWorld'}"
2025-06-11T19:09:35Z,"Xcode 26 code raises hopes for a cheaper Vision Pro, but there’s probably nothing to see here","Macworld







Apple didn’t announce any new hardware at its WWDC 2025 keynote earlier this week, but eagle-eyed beta testers have been busily combing through the code for any references to upcoming product launches. And they have not searched in vain.



…",https://www.macworld.com/article/2812159/xcode-26-code-raises-hopes-for-a-cheaper-vision-pro-but-theres-probably-nothing-to-see-here.html,"{'id': None, 'name': 'Macworld'}"
2025-06-11T19:08:30Z,These iOS 26 features will only be available on newer iPhones,"iOS 26 brings a lot of changes to the iPhone. While the biggest highlight—the Liquid Glass redesign—is available on all iPhones that can run iOS 26, there are several features in the new update that require newer iPhone models and Apple Intelligence. Here are…",https://9to5mac.com/2025/06/11/these-ios-26-features-will-only-be-available-on-newer-iphone-models/,"{'id': None, 'name': '9to5Mac'}"
2025-06-11T19:07:41Z,French President Rallies Behind Mistral-Nvidia Cloud Partnership,France took a major step forward in asserting its artificial intelligence (AI) power Wednesday (June 11) as home-grown startup Mistral AI and U.S. chipmaker Nvidia announced a landmark partnership to develop next-generation AI cloud services in France. [conta…,http://www.pymnts.com/artificial-intelligence-2/2025/french-president-rallies-behind-mistral-nvidia-cloud-partnership/,"{'id': None, 'name': 'pymnts.com'}"
2025-06-11T19:05:00Z,So...Is it Good?: BURY OUR BONES IN THE MIDNIGHT SOIL by V.E. Schwab,"Rebecca Schinksy, Vanessa Diaz, and Danika Ellis go deep on V.E. Schwab's highly anticipated new book to answer the question: So, is it good?

Subscribe to the podcast via RSS, Apple Podcasts, and Spotify.

Sign up for the Book Riot Podcast Newsletter and fol…",https://bookriot.com/listen/bury-our-bones-in-the-midnight-soil-by-v-e-schwab/,"{'id': None, 'name': 'Book Riot'}"
2025-06-11T19:03:06Z,‘Classic Apple': Why Apple is taking the slow road with AI,"Apple is slow-rolling its AI rollout. Whether by design or necessity, it perfectly fits the company's MO.",https://finance.yahoo.com/news/classic-apple-why-apple-is-taking-the-slow-road-with-ai-190306633.html,"{'id': None, 'name': 'Yahoo Entertainment'}"
2025-06-11T19:01:54Z,"RIP: Bill Atkinson, co-creator of Apple Lisa and Mac","RIP: Bill Atkinson, co-creator of Apple Lisa and Mac
His work set the direction of modern computer interfaces, and much more
Obit Bill Atkinson, widely acclaimed as perhaps the most brilliant computer programmer ever, has succumbed to pancreatic cancer at 74.…",https://biztoc.com/x/2be58a5f9a26aa76,"{'id': None, 'name': 'Biztoc.com'}"
2025-06-11T19:01:02Z,watchOS 26 adds new wrist flick gesture for these Apple Watch models,"On of the new features coming to Apple Watch with watchOS 26 this fall is wrist flick. This is a new gesture that unlocks an additional way to interact with incoming notifications. 



Here are the Apple Watch models compatible with wrist flick. 



 more…",https://9to5mac.com/2025/06/11/watchos-26-adds-new-wrist-flick-gesture-for-these-apple-watch-models/,"{'id': None, 'name': '9to5Mac'}"
2025-06-11T19:01:00Z,Patch your Windows PC now before bootkit malware takes it over - here's how,"The flaw is able to skirt past your usual security protection and evade detection, but Microsoft has a patch.",https://www.zdnet.com/article/patch-your-windows-pc-now-before-bootkit-malware-takes-it-over-heres-how/,"{'id': None, 'name': 'ZDNet'}"
2025-06-11T19:00:35Z,Windows Weekly 936: Liquid Aero,"Get to know Microsoft's latest Patch Tuesday updates and new features in Windows 11, such as improvements to the Start menu, File Explorer, and Copilot integration. They also cover new AI features coming to the Photos app for Copilot+ PCs and updates to the M…",https://twit.tv/shows/windows-weekly/episodes/936,"{'id': None, 'name': 'Twit.tv'}"
2025-06-11T19:00:00Z,Apple Intelligence Is About to Face Its Toughest Test: Software Developers,"Granting developers access to Apple's core AI models could finally pull back the curtain on how the tech works, and shed light on whether its 'groundbreaking' privacy promise holds water.
CUPERTINO, Calif.—As we speak, software developers around the world are…",https://uk.pcmag.com/ai/158551/apple-intelligence-is-about-to-face-its-toughest-test-software-developers,"{'id': None, 'name': 'PCMag.com'}"
2025-06-11T19:00:00Z,Here’s What J.K. Rowling Has Actually Said About Trans People,"HBO’s chief content officer says that even though Rowling is EPing its ‘Harry Potter’ reboot, her ‘personal, political views’ won’t be involved. What exactly are those?",http://www.thecut.com/2025/06/heres-what-j-k-rowling-has-really-said-about-trans-people.html,"{'id': None, 'name': 'The Cut'}"
2025-06-11T19:00:00Z,Apple Intelligence Is About to Face Its Toughest Test: Software Developers,"Granting developers access to Apple's core AI models could finally pull back the curtain on how the tech works, and shed light on whether its 'groundbreaking' privacy promise holds water.
CUPERTINO, Calif.—As we speak, software developers around the world are…",https://me.pcmag.com/en/ai/30386/apple-intelligence-is-about-to-face-its-toughest-test-software-developers,"{'id': None, 'name': 'PCMag.com'}"
2025-06-11T18:59:41Z,Feel the Speed With First-Ever Haptic Trailer for F1 Movie [VIDEO],"Apple’s haptic-enabled F1 trailer lets iPhone users physically experience revving engines and road action—streaming now in the TV app.
The post Feel the Speed With First-Ever Haptic Trailer for F1 Movie [VIDEO] first appeared on iPhone in Canada.",https://www.iphoneincanada.ca/2025/06/11/watch-haptic-trailer-for-f1-movie/,"{'id': None, 'name': 'iPhone in Canada'}"
2025-06-11T18:58:13Z,"RIP: Bill Atkinson, co-creator of Apple Lisa and Mac","His work set the direction of modern computer interfaces, and much more Obit  Bill Atkinson, widely acclaimed as perhaps the most brilliant computer programmer ever, has succumbed to pancreatic cancer at 74.…",https://www.theregister.com/2025/06/11/bill_atkinson_obituary/,"{'id': None, 'name': 'Theregister.com'}"
2025-06-11T18:56:00Z,I Want Workout Buddy to Be More Boot Camp Trainer Than Cheerleader on the Apple Watch,"Commentary: The Apple Watch's new coaching feature in watchOS 26 taps your fitness data for live feedback, but don't expect detailed training plans just yet.",https://www.cnet.com/tech/mobile/i-want-workout-buddy-to-be-more-boot-camp-trainer-than-cheerleader-on-the-apple-watch/,"{'id': None, 'name': 'CNET'}"
2025-06-11T18:55:30Z,"Report: Google to Finalize Embrace Magnets, Qi 2 Wireless Charging","It has been some time since Apple introduced MagSafe, even making it available to the Wireless Power Consortium in early 2023. Since then, we have seen hardly any movement on the Android side to adopt this technology, but a new report might shine a bit of lig…",https://www.droid-life.com/2025/06/11/report-google-to-finalize-embrace-magnets-qi-2-wireless-charging/,"{'id': None, 'name': 'Droid Life'}"
2025-06-11T18:53:58Z,Reba Meyers Releases New Single “Clouded World”,"Yet another facet of her solo work emerges.
The post Reba Meyers Releases New Single “Clouded World” appeared first on MetalSucks.",https://www.metalsucks.net/2025/06/11/reba-meyers-releases-new-single-clouded-world/,"{'id': None, 'name': 'MetalSucks'}"
2025-06-11T18:53:29Z,"Podcast Rewind: Chatting with Apple Design Award Winners, Favorite WWDC Announcements, and Transatlantic Tea Talk","Enjoy the latest episodes from MacStories’ family of podcasts: AppStories https://www.youtube.com/watch?v=QR0vXqu5ZA0 For their first WWDC 2025 AppStories episode, Federico and John interview finalists and winners of the Apple Design Award. This episode is sp…",https://www.macstories.net/news/podcast-rewind-chatting-with-apple-design-award-winners-favorite-wwdc-announcements-and-transatlantic-tea-talk/,"{'id': None, 'name': 'MacStories'}"
2025-06-11T18:47:46Z,iOS 26 Lets You Report Spam Voicemails,"iOS 26 has an updated Phone app with several new functions. There are notable new additions like Hold Assist and Call Screening, along with smaller options like a feature to flag spam voicemails.





When you tap into a voicemail from an unknown number, you'…",https://www.macrumors.com/2025/06/11/ios-26-report-spam-voicemail/,"{'id': None, 'name': 'MacRumors'}"
2025-06-11T18:47:17Z,"iPadOS 26 Brings New Mac-Like Features, Multitasking to iPad [VIDEO]","Unlock macOS-style productivity on iPad—iPadOS 26 introduces windowed multitasking, menu bar, Liquid Glass design, Preview, Journal apps, and more.
The post iPadOS 26 Brings New Mac-Like Features, Multitasking to iPad [VIDEO] first appeared on iPhone in Canad…",https://www.iphoneincanada.ca/2025/06/11/ipados-26-mac-like-features-multitasking/,"{'id': None, 'name': 'iPhone in Canada'}"
2025-06-11T18:41:01Z,Google Pixel 10 series might finally copy this long-standing Apple feature,"Google's expected to unveil the Pixel 10 series on August 20, and based on the leaks we've seen so far, these will look almost identical to their predecessors from 2024. But the company is going to pack them with some very interesting updates on the inside - …",https://www.gsmarena.com/google_pixel_10_series_might_finally_copy_this_longstanding_apple_feature-news-68216.php,"{'id': None, 'name': 'GSMArena.com'}"
2025-06-11T18:41:00Z,"Saints minicamp rolls on and we have questions, while LSU heads to Omaha on Dattitude Ep. 384",Top candidate to serve as Alvin Kamara’s primary backup? Does Spencer Rattler have the lead on Tyler Shough at QB? Is LSU in good shape to win title No. 8?,https://www.theadvocate.com/baton_rouge/sports/betting/saints-minicamp-rolls-on-and-we-have-questions-while-lsu-heads-to-omaha-on-dattitude-ep-384/article_4b7c5fe0-5927-5bdc-b80c-495b4c6fc861.html,"{'id': None, 'name': 'The Advocate'}"
2025-06-11T18:40:46Z,"This AirTag alternative is now on sale, and it works with Android just as well",The Pebblebee Clip is the world's first finder tag that works with both Google and Apple Find My networks -- and you can get it for a discount on Memorial Day.,https://www.zdnet.com/article/this-airtag-alternative-is-now-on-sale-and-it-works-with-android-just-as-well/,"{'id': None, 'name': 'ZDNet'}"
2025-06-11T18:40:06Z,New iPhone tools help parent keep kids safer online,"A new Apple system securely shares the age range of children with apps, and prevents kids from new people without permission.
(via Cult of Mac - Your source for the latest Apple news, rumors, analysis, reviews, how-tos and deals.)",https://www.cultofmac.com/news/iphone-tools-parents-keep-kids-safe-online,"{'id': None, 'name': 'Cult of Mac'}"
2025-06-11T18:40:00Z, Soccer nation: The secrets behind the USA’s football revolution,"In just one year, the entire planet will be looking at the United States. And not only for political or economic reasons, but also for football reasons. The country of bars and stars will host, along ...",https://onefootball.com/en/news/soccer-nation-the-secrets-behind-the-usas-football-revolution-41234179,"{'id': None, 'name': 'Onefootball.com'}"
2025-06-11T18:37:38Z,China Is Set To Outpace the US in Clean Data Dominance | Opinion,Now is the time to lead.,https://www.newsweek.com/china-set-outpace-us-clean-data-dominance-opinion-2084189,"{'id': 'newsweek', 'name': 'Newsweek'}"
2025-06-11T18:36:53Z,"Yes, Taylor Swift eats fast food too — here’s the go-to spots she loves and exactly what she likes to order","Pop icon Taylor Swift, despite her global fame, enjoys simple fast food meals. From Shake Shack in New York to Nando's in the UK, Swift's cravings are relatable.",https://economictimes.indiatimes.com/news/international/us/yes-taylor-swift-eats-fast-food-too-heres-the-go-to-spots-she-loves-and-exactly-what-she-likes-to-order/articleshow/121786223.cms,"{'id': 'the-times-of-india', 'name': 'The Times of India'}"
2025-06-11T18:32:47Z,Apple TV+ is about art more than iPhone sales says Tim Cook,"The immense spending on Apple TV+ projects like ""F1"" is less about selling more iPhones to the public, and more about the art itself, according to CEO Tim Cook.CEO Tim Cook during the WWDC 2025 'F1' skit - Image Credit: AppleApple TV+ is well known as a well-…",https://appleinsider.com/articles/25/06/11/apple-tv-is-about-art-more-than-iphone-sales-says-tim-cook,"{'id': None, 'name': 'AppleInsider'}"
2025-06-11T18:32:15Z,Apple reveals new iOS 26 features and its Liquid Glass redesign at WWDC 2025 - Engadget,Apple reveals new iOS 26 features and its Liquid Glass redesign at WWDC 2025Engadget Apple introduces a delightful and elegant new software designApple A big list of the small and hidden features in iOS 26TechCrunch Every New iOS 26 iPhone Feature: Liquid Gla…,https://slashdot.org/firehose.pl?op=view&amp;id=178010233,"{'id': None, 'name': 'Slashdot.org'}"
2025-06-11T18:28:55Z,Apple Lists 10 Airlines Set to Offer iOS 26's Upgraded Boarding Passes,"As we previously reported, iOS 26 enhances Apple Wallet app boarding passes in a few ways. First, the passes now support Live Activities, allowing you to keep track of a flight at a glance on your iPhone's Lock Screen, and in the Dynamic Island on the iPhone …",https://www.macrumors.com/2025/06/11/apple-wallet-enhanced-boarding-pass-airlines/,"{'id': None, 'name': 'MacRumors'}"
2025-06-11T18:28:34Z,"At WWDC, Apple says it will use AI to tag apps to improve discoverability on the App Store","Apple will begin using AI technology to power the discovery of apps on the App Store, the company announced at this week’s Worldwide Developers Conference (WWDC 25).
In a session focused on updates to App Store Connect, its app distribution platform for devel…",https://biztoc.com/x/eb7e98c9aaab3514,"{'id': None, 'name': 'Biztoc.com'}"
2025-06-11T18:28:01Z,Trump trumpets trade deal with China that's still terrible for Apple,"In an ambiguous post today, President Donald Trump noted that he's close to a deal with China, that's still worse for Apple and the US economy than what was in place before his April tariff program launch.Tim Cook and Donald Trump in a meeting at the White Ho…",https://appleinsider.com/articles/25/06/11/trump-trumpets-trade-deal-with-china-thats-still-terrible-for-apple,"{'id': None, 'name': 'AppleInsider'}"
2025-06-11T18:27:52Z,"A24 movie based on viral found-footage horror videos adds Worst Person in the World actor to cast, taking the previously reported role of The Penguin star",Renate Reinsve is set to star in The Backrooms,https://www.gamesradar.com/entertainment/horror-movies/a24-movie-based-on-viral-found-footage-horror-videos-adds-worst-person-in-the-world-actor-to-cast-taking-the-previously-reported-role-of-the-penguin-star/,"{'id': None, 'name': 'GamesRadar+'}"
2025-06-11T18:27:00Z,"Wait, I’m actually excited for these two Apple Intelligence features","While Apple hasn’t given any new information about its next AI upgrade for Siri, it has a handful of new Apple Intelligence features coming later this year in macOS 26, iOS 26, and iPadOS 26 that look extremely useful. The Reminders feature should be easy eno…",https://mobilesyrup.com/2025/06/11/apple-intelligence-features-ios26-macos26-ipados26/,"{'id': None, 'name': 'MobileSyrup'}"
2025-06-11T18:26:05Z,Tim Cook: This is why we decided to do Apple TV+,"In a new interview published on Wednesday, Apple CEO Tim Cook reveals the reason why Apple is in the movies and TV businesses…
The post Tim Cook: This is why we decided to do Apple TV+ appeared first on MacDailyNews.",https://macdailynews.com/2025/06/11/tim-cook-this-is-why-we-decided-to-do-apple-tv/,"{'id': None, 'name': 'Macdailynews.com'}"
2025-06-11T18:25:08Z,Apple Expands Child Safety Protections and Options for Parents,"Apple today announced new features for its child-safety and parental controls features in its platforms, including iOS for iPhones. Apple will be expanding its number of age range categories to include under-13, 13+, 16+, and 18+. Apps with an overall rating …",https://www.phonescoop.com/articles/article.php?a=23544,"{'id': None, 'name': 'Phonescoop.com'}"
2025-06-11T18:19:47Z,Haptic trailer for Apple TV+ movie F1 lets you feel the racing action,"A new type of ""haptic trailer"" for Apple Original film ""F1: The Movie"" adds a new dimension to the movie's roaring race cars.
(via Cult of Mac - Your source for the latest Apple news, rumors, analysis, reviews, how-tos and deals.)",https://www.cultofmac.com/news/haptic-trailer-f1-movie,"{'id': None, 'name': 'Cult of Mac'}"
2025-06-11T18:17:33Z,"At WWDC, Apple says it will use AI to tag apps to improve discoverability on the App Store","Apple will begin using AI technology to power the discovery of apps on the App Store, the company announced at this week’s Worldwide Developers Conference (WWDC 25). In a session focused on updates to App Store Connect, its app distribution platform for devel…",https://techcrunch.com/2025/06/11/at-wwdc-apple-says-it-will-use-ai-to-tag-apps-to-improve-discoverability-on-the-app-store/,"{'id': 'techcrunch', 'name': 'TechCrunch'}"
2025-06-11T18:15:47Z,"Chris Hutchins, Deal Master — Helping Tim Burn 15M+ Miles and Points, Flipping Costco Gold Into Five-Star Trips, Flying to Japan for $222, Tech Tools and Tricks, and Avoiding The Optimizer’s Curse (#815)","Interview with Chris Hutchins of All the Hacks! 
The post Chris Hutchins, Deal Master — Helping Tim Burn 15M+ Miles and Points, Flipping Costco Gold Into Five-Star Trips, Flying to Japan for $222, Tech Tools and Tricks, and Avoiding The Optimizer’s Curse (#81…",https://tim.blog/2025/06/11/chris-hutchins-all-the-hacks/,"{'id': None, 'name': 'Tim.blog'}"
