timestamp,source,headline,text,url,company
1752693088.0,reddit,Annual PSA: Investing and Trading Scam Reminder,"For those new to Reddit and to investing and trading - please be aware that social media platform like Reddit, Discord, etc. can be a vector for scams and fraud. 

Offers to DM should be viewed as suspicious. 

Social media platforms continue to be a common method to recruit new investors to pig-buthering scams and pump-and-dump scams. - do not assume that an offer to ""help"" is legitimate.

1. Good explanation of pig-buthering here - [Pig butchering - how to spot](https://dfpi.ca.gov/news/insights/pig-butchering-how-to-spot-and-report-the-scam/)
2. It is common for bots and malicious actors on Discord to impersonate Reddit and Discord mods to distribute their scams. It is possible to create a Discord profile which appears similar to someone else.
3. Pump and dump of stocks are common on social media - bots or stock promoters who are seeking to profit from pumping a stock or to create hype. You can sometimes identify if it's a bot or promoter simply by looking at the posters comment and post history. Often you will see that the account has posted nothing related to investing or trading but suddenly there is the same or varying versions of comments on one or two specific stocks.
4. One other way to recognize suspicious posts is if the OP never engages in a discussion on comments and questions in the thread on their own dd. Those are all signs of stock promotion.
5. Offers to mirror trade and teach you how to trade are usually fake. If you receive private solicitations to open accounts at a broker or investment adviser, be wary.

If you are in the US - you can always verify the legitimacy of a broker or investment adviser. You can check the registration status of a broker at the FINRA web site here - [https://brokercheck.finra.org/](https://brokercheck.finra.org/) You can check disclosures for investment advisers at the SEC IAPD web site here - [https://adviserinfo.sec.gov/](https://adviserinfo.sec.gov/)

For those interested in understanding a little more about stock promoting and pump-and-dumps - one of the mods provided an AMA 15 years ago about a penny stock pump operation that he unwittingly became associated with - you can find the AMA here - [https://www.reddit.com/r/investing/comments/158vi7/i\_used\_to\_be\_a\_penny\_stock\_promoter\_in\_the\_late/](https://www.reddit.com/r/investing/comments/158vi7/i_used_to_be_a_penny_stock_promoter_in_the_late/)",https://www.reddit.com/r/investing/comments/1m1llzv/annual_psa_investing_and_trading_scam_reminder/,
1754339990.0,reddit,Update: How do I invest in Passion Fruit,"https://imgur.com/a/A8RXF4E

Here are my first three vines that I am planting in coco fiber tonight, it’s been raining like crazy here and all my plant are thriving so I’m optimistic. 

I’m looking at land around the north Georgia area as a land investment and also just plant whatever I want to leave and let grow for future projects, IE passion fruit. 

No luck teaming up with someone in another country, lots of people willing to sell the plants in their yards though! Haha.


Thanks for the information everyone, I actually learned a lot going down this casually shallow rabbit hole, 😅. ",https://www.reddit.com/r/investing/comments/1mhp2ug/update_how_do_i_invest_in_passion_fruit/,
1754362290.0,reddit,Investing for siblings future,"I would like to begin DCA on something for each (2) of my siblings. The intention would be to give it to them when their first child turns 18 but it could also be for an emergency or just a time when they need it. I am wondering the simplest way to go about this. My first though was to choose a target date fund for each of them within my individual brokerage and contribute regularly and then transfer the stock (something I just learned you can do) to them when they need it/when I choose to give it to them. 

  
I want something low risk and boglehead-ish hence my idea of a target date fund. Does anyone else invest for their siblings and if so what is your methodology?   
  
Thank you.",https://www.reddit.com/r/investing/comments/1mhxr2y/investing_for_siblings_future/,
1754260265.0,reddit,"""At that P/E rate, it would take 'X' years to recoup your investment""","I heard this today on a video about palantir. The guy said it has a P/E of 670, meaning it would take you 670 YEARS to get your money back.

I searched google and had a long conversation with ChatGPT that went nowhere. I now understand P/E ratios when it comes to ""*A P/E of 670 means you pay $670 for every $1 the company earns annually""* because I heard a great vending machine analogy and I read a comparison about Microsoft.

(**Machine** **costs $2,000 up front. makes $200 a year; P/E = 10x**).

What I **don't** understand is the notion that it would take **ME,** the **STOCK INVESTOR**, that much time.

I feel blindsighted by the fact that the only money I will ever see is from when the value of the stock goes up.

The ""670 years"" thing to me makes no sense. Not that it makes no sense, as in I understand where it's coming from, but it's just untrue to me. It makes no sense **simply because I don't get it**, and can't find any resources that know what I mean when posing my question.

The root of my problem may be my ability to explain my confusion, but I tried to do my best to put it all together here, and the clarity seems perfect to me. Maybe the issue is everyone takes this phrase a face value and doesn't think about its meaning?... Idk.

The vending machine analogy was a great way for me to understand it when it comes to someone who actually gets the profit, but I'm completely failing to comprehend its connection to investing.

(Video with timestamp for context: https://youtu.be/raE9f9swVxU?si=UgpbCeGxiwqEY20G&t=666)",https://www.reddit.com/r/investing/comments/1mgwm23/at_that_pe_rate_it_would_take_x_years_to_recoup/,
1754257350.0,reddit,What if your portfolio is a bet on a world that no longer exists?,"Most portfolios today are implicitly short inflation, long central bank control, and long political cohesion. That worked for the last cycle. But the underlying assumptions are starting to rot.

Fiscal and monetary policy have merged in practice, if not in name. The US is running structurally high deficits in peacetime, with no political appetite for austerity. Demographics are slowing, labor is tight, and the Fed is trapped between managing inflation optics and funding the Treasury.

If that’s directionally correct, then the real risk isn’t another 2008. It’s something closer to an inflationary recession - stagflation with political dysfunction. The kind of scenario where bonds don’t hedge, equities de-rate, and the market begins repricing money itself.

Traditional portfolios aren’t built for that. They’re priced for a continuation of the post-Volcker paradigm. They assume trust, continuity, and policy efficacy. All of which look increasingly fragile.

Digital assets sit awkwardly in this context - not as a clean hedge, but as a reflexive proxy for declining faith in fiat institutions. Not because they’re intrinsically valuable, but because they’re perceived as outside the system.

None of this is an argument for crypto exposure in itself. But it’s worth asking if traditional monetary mechanisms have been changing to adapt to a non-fiat world, why haven’t our portfolios?",https://www.reddit.com/r/investing/comments/1mgvgy3/what_if_your_portfolio_is_a_bet_on_a_world_that/,
1754365180.0,reddit,Aurora Innovation - AUR - Current Leader in Autonomous Trucking,"https://aurora.tech/

Aurora Innovation (AUR) – Front Runner in Autonomous Trucking

Aurora Innovation is emerging as a leading player in autonomous trucking software and hardware, already conducting real-world testing on major U.S. freight routes.

⸻

Key Highlights • Cash on hand: $1.15–1.2B • Burn rate: $142M per quarter (~$600–700M annually) • Runway: ~6–7 quarters (18–22 months) at the current burn rate • Next steps to extend runway: Reduce burn, raise new funds, or both

⸻

Strategic Partnerships

Aurora has built strong alliances to accelerate autonomous trucking commercialization. Partnerships include: • Nvidia & Continental – hardware and software development for autonomous systems • Uber Freight, FedEx, Hirschbach, PACCAR, Ryder, Schneider, Volvo – logistics and trucking ecosystem collaborations

⸻

Founding Team • Chris Urmson – Former CTO of Google’s self-driving team (Waymo) • Sterling Anderson – Former head of Tesla Autopilot • Drew Bagnell – Former head of Uber’s autonomy and perception team

⸻

Current Testing • Test runs between Houston ↔ Dallas • Recently started El Paso ↔ Phoenix route (1,000 miles / 14 hours) • Advantage: This route exceeds the FMCSA Hours of Service limit (max 11 driving hours per day), giving autonomous trucks a major legal efficiency advantage.

⸻

Competitive Landscape • Waymo – No longer in trucking; focused on robo‑taxis • Other competitors are either speculative or private (not investable) • Likely no “winner-take-all” scenario; leadership could shift over 5–10 years

⸻

Investment Thesis • Market Cap: ~$11B (vs. Waymo at ~$45B) • No debt and $1B cash on hand • Analysts value AUR around $10/share

Upside Potential • 0.5–2 years: Possible 100% gain • By 2030: Potential 10x return if Aurora emerges as a dominant player

⸻

Personal Position • Holding 3,000 shares • $4,000 in Jan 2026 $10 calls $10–$15 2027 LEAPS",https://www.reddit.com/r/investing/comments/1mhyqom/aurora_innovation_aur_current_leader_in/,
1754362783.0,reddit,"This is my first year after creating this portfolio, any advice for me?","My budget Bi-weekly is $300 CAD, with a specific percentage allocation. This is what my portfolio consists of:

VOO - 46% - $138 (US Equity)

QCN - 21% - $63 (Canadian Equity)

ZEA -16% - $48 (International Dev. Equity)

EEMV - 11% - $33 (Emerging Market Equity)

GLDM - 5% - $15 (Gold)

SNGX - 1% - $3 (Individual Stock)

Is this a good diversification? Or too much? Thanks guys",https://www.reddit.com/r/investing/comments/1mhxx7u/this_is_my_first_year_after_creating_this/,
1754362381.0,reddit,"Built a tool to break down 10-Ks into interactive maps, curious if it is useful for fundamentals research","Hi all, I’ve been working on a tool that turns long-form filings like 10-Ks into interactive knowledge maps to make it easier to analyze company fundamentals.

We started by mapping the 2024 10-Ks of NVIDIA, Apple, Microsoft, Amazon, and others. Each map pulls out segments like revenue breakdowns, growth drivers, strategic bets, and risk factors in a structure you can navigate visually.

You can also upload your own filings or reports for any company and the tool will auto-map them in the same way.

Here’s the collection: [https://www.proread.ai/company10ks](https://www.proread.ai/company10ks)

Would appreciate feedback on:

• Whether this is useful for researching public companies  
• What other filings or docs you’d want auto-mapped like this  
• What worked or didn’t if you tried uploading your own  
• Any missing functionality for investing workflows

Not selling anything. Just trying to make reading 10-Ks a little easier. Curious what this community thinks.",https://www.reddit.com/r/investing/comments/1mhxs85/built_a_tool_to_break_down_10ks_into_interactive/,
1754322073.0,reddit,Is the Bloomberg news app better with a subscription?,"I have been considering paying for a subscription to Bloomberg news, but am a bit put off by the horrible performance of the app (I have a free trial version currently). I will click on a headline in the notification drawer and won't see the actual article until 5+ seconds later. Just checking that this isn't due to the free version being intentionally shitty or something.",https://www.reddit.com/r/investing/comments/1mhgwmg/is_the_bloomberg_news_app_better_with_a/,
1754341439.0,reddit,What factors to consider while selling TIPS ?,"I bought some TIPS, by mistake ( got confused on the treasury website where i actually wanted to buy a Series I bond, during the high yield years)

  
I see it pays a miniscule interest and has been only going down in value 

|Acquired|Term|$ Total Gain/Loss|% Total Gain/Loss|Current Value|Quantity|Average Cost Basis|Cost Basis Total|
|:-|:-|:-|:-|:-|:-|:-|:-|
|Mar-31-2022|Long|\-$1,486.17|\-12.31%|$10,588.60|10,000|$1.21|$12,074.77|
|Jan-31-2022|Long|\-$723.84|\-12.03%|$5,294.30|5,000|$1.20|$6,018.14|

  
**Question** \- what factors to consider if I should sell these at a loss (may be to harvest stock gains) ? Should i persist for some 'x' amount of time, before throwing in the towel (and may be buy NVDA to cover up for all the losses :D )",https://www.reddit.com/r/investing/comments/1mhppwu/what_factors_to_consider_while_selling_tips/,
1754338126.0,reddit,QQQI vs QQQ/SCHG? Why does QQQI appear to be the better option due to market volatility and potential sideways action?,"I am trying to redo my portfolio in my roth after making some amazing gains with MSTR and COIN. I am trying to find a place to stick this money for the next 25-years (checking on it quarterly and reassessing) to maximize my returns. I have come across QQQI and it seems like an amazing option if the market remains volatile (Trump makes that a certainty) and just moves sideways when compared to QQQ/SCHG.

Can anyone explain why QQQI would be a bad choice? I have reviewed the VXN since 2001 and it seems to stay high enough to keep QQQI providing decent yield (10%+) without eroding the NAV.

I am trying to hedge against sideways movement in the market since current prices seem too elevated and the economy in general seems to be slowing down. QQQI appears to be able to offer steady yield even in a sideways /downtrend market, thus potentially outperforming the typical qqq/schg.",https://www.reddit.com/r/investing/comments/1mho8vs/qqqi_vs_qqqschg_why_does_qqqi_appear_to_be_the/,
1754333144.0,reddit,44 and changing careers. What to do with my 401k?,"Hey guys!

I am starting a new job next week. Ive been employed at this job for 19.5 years but we didnt have a 401k till more recently. I only have about $35k in there now. Moving to this new job I would like to move/roll over the funds into an account I could have more access too in the event I am unemployed for any number of months.

I know I can cash it out minus 10% and minus taxes. I am looking at opening a Charles Schwab account maybe. I am a bit lost here. What options do I have? I appreciate any advice!",https://www.reddit.com/r/investing/comments/1mhlzx8/44_and_changing_careers_what_to_do_with_my_401k/,
1754337972.0,reddit,iShares LifePath Target Date ETF's,Thoughts about these Black Rock target date ETF's? Created in 2023 and up 42% since then. I'm rolling my previous employer 401K into an IRA to park it there and considering putting it all into one of these target date funds. Is this a bad idea for any reason?,https://www.reddit.com/r/investing/comments/1mho6gz/ishares_lifepath_target_date_etfs/,
1754255810.0,reddit,Current sentiment on AMD? Sell before earnings? Or hold?,"What’s the general sentiment now? For the better part of the year, many people have been calling AMD the “Advanced Money Destroyer.”

It seems that despite positive earnings, AMD stock always seems to find a reason to go down.

Even if it goes up to $200/share, that’s only a 10-15% increase from the current price compared to the potential downside. Thoughts?


",https://www.reddit.com/r/investing/comments/1mguuky/current_sentiment_on_amd_sell_before_earnings_or/,
1754314003.0,reddit,a list of uk defense shares - 30 companies i could find. any more out there?,"1. **Defence Holdings PLC** A micro-cap defence investment company; details on MoD contracts are limited or not publicly disclosed.
2. **Thruvision Group PLC** Supplies people-screening technology used by border agencies and has secured contracts with UK Border Force.
3. **Westminster Group PLC** Provides security services and equipment to governments and airports; has worked with African governments and UK MoD-related contracts.
4. **Kromek Group PLC** Supplies radiation detection technologies; awarded multiple contracts by the UK MoD and US DOD.
5. **Petards Group plc** Supplies surveillance and communication systems; has a history of MoD contracts for train and defence communication systems.
6. **RC Fornax PLC** A new entrant focused on software and defence technology; limited information available on government contracts.
7. **Velocity Composites PLC** Supplies composite materials to the aerospace and defence sector; serves Tier-1 suppliers to MoD projects like Typhoon.
8. **Croma Security Solutions Group PLC** Provides security guarding and technology solutions; has supplied services to government buildings and military facilities.
9. **Newmark Security PLC** Offers electronic security and workforce management solutions; supplies systems to government and defence-related clients.
10. **Filtronic Plc** Specialises in RF communications; involved in aerospace and defence projects, including partnerships aligned with MoD goals.
11. **NCC Group PLC** Cybersecurity and software assurance provider; works with UK government and defence departments on cyber resilience.
12. **Intercede Group plc** Provides digital identity and credential management; works with UK and allied defence sectors for secure access.
13. **Concurrent Technologies PLC** Manufactures embedded computer systems used in defence; supplies components into UK and NATO-aligned platforms.
14. **Senior plc** Aerospace and defence engineering group; supplies components to MoD programmes like fighter jets and submarines.
15. **Serco Group plc** Operates public services including defence and border control; holds major MoD contracts for base operations and IT.
16. **QinetiQ Group plc** One of the UK’s largest defence technology providers; works extensively with MoD on research, trials, and training.
17. **Chemring Group plc** Supplies countermeasures and sensors; key contractor to MoD and NATO on EOD and EW solutions.
18. **Melrose Industries PLC** Owns defence-focused engineering subsidiaries like GKN Aerospace; indirectly serves MoD platforms.
19. **Science Group PLC** Provides R&D services, including to defence and security agencies; has worked with MoD via its TSG division.
20. **Gooch & Housego** Supplies photonics for aerospace and defence; provides components used in MoD platforms like guided weapons.
21. **Future of European Defence UCITS ETF** An ETF tracking European defence companies; includes firms with exposure to UK and EU defence contracts.
22. **Babcock International Group PLC** Major MoD contractor in naval and nuclear support; manages submarine programmes and training.
23. **Rolls-Royce Holdings PLC** Key MoD partner for aircraft engines and nuclear submarines; integral to Typhoon and Dreadnought programmes.
24. **MS International plc** Supplies naval gun systems and engineering services to the MoD and other NATO governments.
25. **Cohort PLC** Group of defence tech firms; works directly with MoD on electronic warfare, communications, and naval systems.
26. **Ab Dynamics PLC** Focuses on vehicle testing systems; some applications in defence vehicle development, but not a core MoD supplier.
27. **BAE Systems plc** The UK’s largest defence contractor; backbone of MoD air, sea, and cyber capabilities.
28. **IMI plc** Supplies precision-engineered components; has supplied systems for defence and aerospace programmes.
29. **Avon Technologies PLC** Specialises in respiratory protection for defence forces; long-standing MoD supplier of gas masks and PPE.
30. **Smiths Group plc** Supplies detection and diagnostics equipment; works with MoD and other governments in CBRN defence.",https://www.reddit.com/r/investing/comments/1mhdeny/a_list_of_uk_defense_shares_30_companies_i_could/,
1754361552.0,reddit,The Safety of the Stock Market,"Do we think that the Stock Market will truly continue to grow for the next 40+ years? Are we true to expect 7% rates annually (on average) from the S&P 500? I truly just wonder the true likelihood that it will simply continue to grow. Almost everything stops growing after a while, what makes we sure that the market will continue to go up? ",https://www.reddit.com/r/investing/comments/1mhxhwj/the_safety_of_the_stock_market/,
1754336726.0,reddit,Too early to determine AI winners?,"I think a lot of younger investors (including myself) have shifted their focus to most of the major AI companies in today’s day and age, and rightly so. However, if we remember early tech companies e.g blackberry, that held a dominant market position in their prime, back then it would have been seen as a great investment. Of course however as time showed, other competitors proved to be better, such as Apple with their innovative tech.

So, my question is, seeing as the real winners of these booms often don’t emerge until later on, is it foolish to think that investing in modern equivalents e.g nvidia, amd, is not sustainable and it would be better to wait and see what other companies emerge that may outcompete?",https://www.reddit.com/r/investing/comments/1mhnmht/too_early_to_determine_ai_winners/,
1754311416.0,reddit,Alternative bond index to VUSXX,"Unfortunately my bank JP Morgan Chase won't offer this vanguard bond index. 

[https://investor.vanguard.com/investment-products/mutual-funds/profile/vusxx](https://investor.vanguard.com/investment-products/mutual-funds/profile/vusxx)

Are there any similar alternatives to this that be purchased at Chase?",https://www.reddit.com/r/investing/comments/1mhceaz/alternative_bond_index_to_vusxx/,
1754307714.0,reddit,"For an ETF... how much does liquidity, AUM etc matter?","Hi all,

I'm thinking about making my next investment into international be either [AVNM](https://www.avantisinvestors.com/avantis-investments/avantis-all-international-markets-equity-etf/) or [DFAX](https://www.dimensional.com/us-en/funds/dfax/world-ex-us-core-equity-2-etf) whereas I historically invested VXUS for the same thing. 

[https://portfolioslab.com/tools/stock-comparison?d=e54c257](https://portfolioslab.com/tools/stock-comparison?d=e54c257)

The big differences are: 

1. Expense ratios (AVNM and DFAX are about equal but more expensive than VXUS)
2. The [returns](https://portfolioslab.com/tools/stock-comparison?d=e54c257) for AVNM > DFAX > VXUS which offsets the expense ratio 
3. In terms of liquidity and AUM: VXUS > DFAX >> AVNM

So my questions is: with regards to #3 does it matter how liquid these funds are or how many AUM they have? I'm more of a ""buy and forget"" / ""buy and hold forever"" kind of investor. 

  
Any other thoughts / opinions on these ETFs are welcome as well. 

  
PS: A point for the mods: I had a great table that summarized the differences between these ETFs but it was ""AI generated"" because why would I spend time scouring the internet for data and pasting into a table... in 2025... but for some reason it can't be posted (because it's AI generated... I have no idea how the editor knows... I tried pasting into a spreadsheet first). It would've greatly helped with readability. That's a loss. ",https://www.reddit.com/r/investing/comments/1mhb3x8/for_an_etf_how_much_does_liquidity_aum_etc_matter/,
1754341252.0,reddit,PEW looks to be having some wild months ahead,PEW looks to be a stock that dropped like crazy upon open on July 16th hit the bottom and now has a CEO who jusy announced $20 million buyback so share picea are bound to make a run. Do your own DD but seems like a good investment opportunity. Company has been in business for over a decade benevolent ceo and lots of benefits. Look into it and make your own decisions ,https://www.reddit.com/r/investing/comments/1mhpmx1/pew_looks_to_be_having_some_wild_months_ahead/,
1754260867.0,reddit,Anyone using an api to track earnings/dividends/insider trades?,"I'm trying to build a personal tracker for earnings dates, dividend updates, and insider trades. Looked at a few APIs, one called Mboum API came up that seems to offer all that. Just wondering if anyone here has tried it or something similar? Would be cool to hear what people are using for this kind of stuff and if it’s even worth automating.",https://www.reddit.com/r/investing/comments/1mgwugp/anyone_using_an_api_to_track/,
1754270970.0,reddit,$TIP Inflation Protected Bond ETF 7% spike - someone making a hyperinflation bet?,"Seemed to stick out among Trump and Powell Riff or the market pricing in Powell’s successor? Is this a move to follow bond yields recent increase? Of course there is a Low liquidity market potential at play here. 

What next dominos fall to adjust for Trump’s apparently longer term plan to run the economy hot hot hot.",https://www.reddit.com/r/investing/comments/1mh0g2h/tip_inflation_protected_bond_etf_7_spike_someone/,
