title,text,created_utc,url,subreddit
FXE to hedge against weak dollar,"Dollar is falling. Is FXE good hedge for this? 

Or is it better to directly convert to other currencies and hold it for a period? 

I don’t know how to hold the currency of other countries and if it’s safe especially since I’m not a European citizen. Say they allow me to open international account but there’s no police to monitor fraud. 

Or, is gold the only option? 

It keeps falling. I’m not so glad to see the stock rising because dollar is falling, so it’s water.",1751349158.0,https://www.reddit.com/r/stocks/comments/1lotzya/fxe_to_hedge_against_weak_dollar/,stocks
"CRCL IPO Surges , Is It Still Worth Buying Or Overpriced?","Circle just smashed their IPO  jumped from $69 to around $180 in no time, over 160% gain. That’s huge for a stablecoin play, biggest crypto IPO since Coinbase back in ‘21

They’re the big name behind USDC, probably the most trusted stablecoin out there. Plus, with the Senate passing the GENIUS Act, regulatory headwinds look softer, which should be a tailwind

From a trader’s standpoint, this thing’s gotta be volatile AF in the short term. Sure, long-term stablecoins look like a massive theme, but buying here feels like you’re paying a premium for hype

I personally feel that short-term speculation can pay attention to the pullback opportunity, but if you really intend to hold long-term, you have to keep an eye on the regulation and industry dynamics, after all, stable coins are a big trend but also full of uncertainty",1751299664.0,https://www.reddit.com/r/stocks/comments/1lobics/crcl_ipo_surges_is_it_still_worth_buying_or/,stocks
MTG buys Snowflake - does she know something we don't?,"Brought June 17th - it's up 6% already and technicals indicate further continuation up.

  
As a reminder, Snowflake (SNOW) is a cloud-based data warehouse that has a large marketplace especially among the AI community.

  
Anyone else participating in this rally?",1751244094.0,https://www.reddit.com/r/stocks/comments/1lnua7s/mtg_buys_snowflake_does_she_know_something_we_dont/,stocks
CNRG has outperformed TAN/ICLN/QCLN for clean energy,"We all know that clean energy is majorly struggling right now. Nonetheless, I wanted to point out that in the last 5 years, we have 

CNRG +15.54% 

ICLN +2.02%

QCLN +6.5%

TAN -7.77%

https://www.google.com/finance/quote/CNRG:NYSEARCA?hl=en&window=5Y&comparison=NASDAQ%3AICLN%2CNASDAQ%3AQCLN%2CNYSEARCA%3ATAN",1751312961.0,https://www.reddit.com/r/stocks/comments/1lohay7/cnrg_has_outperformed_taniclnqcln_for_clean_energy/,stocks
"Microsoft's AI Revenue to Reach $25 Billion, Wedbush Raises Target Price to $600","According to the latest report by Wedbush analyst Daniel Ives, Microsoft ($MSFT)'s leading position in the enterprise AI market continues to strengthen. The AI product Copilot is expected to contribute $25 billion in revenue in the fiscal year 2026. The institution has raised the target price from $515 to $600 and reaffirmed the ""outperform"" rating.

Currently, I hold a small position in $MSFT. This post only shares information and does not constitute investment advice.

Source: [Investing.com](http://Investing.com) / Wedbush Research Report",1751226870.0,https://www.reddit.com/r/stocks/comments/1lnnw1q/microsofts_ai_revenue_to_reach_25_billion_wedbush/,stocks
Time to Sell Apple?,"Is it time to start slowly selling Apple?  It was my go to stock and i got some returns, but
The past decade i dont see any innovation, and seems  they are not planning to.
They seem to get beat up in AI / AR by competitors.
Rumors Apple going to Auto also failed.
Apple vision had great idea, but failed because of pricing. 

They do great product, but no longer innovative for me. 

I wonder what are your thoughts. 

And i dont see any future while Tim Cook is CEO. 
",1751360210.0,https://www.reddit.com/r/stocks/comments/1lowqud/time_to_sell_apple/,stocks
Most people think the Circle IPO is flopping but they are wrong.,"The Circle IPO has been one of those rare market moments that force even the most skeptical to open their eyes, their minds.

This issuer of US dollar stablecoin went public on June 5th at $31 and closed yesterday at $180 ($44B market cap), down from a staggering $300.

Most people still barely know what a dollar stablecoin is, and even fewer know how they work.

Some people have heard that dollar stablecoin adoption will extend the greenback’s reign as the global reserve currency for decades to come. It will. 

But not many understand why. And forward-thinking strategists forecast that dollar stablecoins will soon become the world’s leading buyers of treasury bills, replacing nations like China and Japan as the largest lenders to the US government.

Most people scoff at that notion. They’re wrong.

The world is changing fast. And it is generally true that investors who tune into the wisdom of markets succeed, often spectacularly, while the others trail, fail.

Markets are starting to tell us that something important is unfolding in crypto infrastructure, lifting the price of companies that help incumbent financial firms to transition to blockchain-based rails.

The process has clearly begun, making financial transactions faster, cheaper, more secure, and transparent.

It’ll take the better part of a decade to complete, at which point today’s skeptics will be able to explain in great detail how it all works, and why this mega macro-trend became rather obvious, just after the Circle IPO.",1751375828.0,https://www.reddit.com/r/stocks/comments/1lp1fmx/most_people_think_the_circle_ipo_is_flopping_but/,stocks
Nvidia Insiders Sold Over $1B in Stock  Should We Be Worried?,"According to the Financial Times (via Reuters), Nvidia insiders have sold over $1 billion worth of stock over the past year  $500M just this month, right as NVDA hit all-time highs

Even Jensen Huang started selling this week for the first time since September  Meanwhile, NVDA is up 60%+ from its April lows, fueled by the AI boom and optimism around easing Trump-era tariffs

Yes, it's normal for insiders to take profits  but does the timing concern you? Are we nearing a short-term top, or is this just smart rebalancing while retail stays bullish?Personally, I'm still holding, but watching for signs of overextension",1751202927.0,https://www.reddit.com/r/stocks/comments/1lnefep/nvidia_insiders_sold_over_1b_in_stock_should_we/,stocks
What's the next big thing?,"I kind of missed the train on the current favourites (PLTR, ASTS, OKLO etc…). Looking for stocks that can (or starting to) take off and could become big players in the near future.

Are there any promising companies that are worth holding and can have a significant reward in investing? I am not particularly concerned with the sector, though looks like AI, space, robotics and defence stocks are particularly great nowadays. As long as it has a good runway for growth, I am in. 

Currently own MVST, RDW, JOBY and ACHR. 

Any recommendations?",1751205010.0,https://www.reddit.com/r/stocks/comments/1lnf5lu/whats_the_next_big_thing/,stocks
Google stock being pushed,"I've seen a recent uprise of google stock articles saying it's the best AI play right now, that the stock is not as valuable as it should be as an AI player. 

But this feels off, ChatGPT is practically threatening google search (The main revenue of their ads business).

They also fail to point out that google had chatGPT technology before OpenAI was created but they decided to focus on marketing (You know ads after ads ruining their service).

And now google query search is hitting lows never seen in decades:

[https://www.statista.com/statistics/216573/worldwide-market-share-of-search-engines/](https://www.statista.com/statistics/216573/worldwide-market-share-of-search-engines/)

Averaging between 2015-2022 87%.

After ChatGPT release in November 2022 It's down to 79%. And I think it's pretty correlated.

It's not difficult to realize most people are done with searching stuff on multiple websites. Even ChatGPT can handle boomers writing type (Google can't)

Google(and websites) ruined google search, prioritized ads, and the overall internet website stuff became supper annoying (pop-ups, cookies, ads, login, subscribe to read the full content).

  
Now, why I think they are pushing Google stock? I think they realized the company is going to get hammered hard in the next decades and it's easy to see that google can't execute for a long time, to try to salvage the situation. And they want to opt-out and find better AI plays.

  
I hold no google, but own other AI stocks.",1751355407.0,https://www.reddit.com/r/stocks/comments/1lovloi/google_stock_being_pushed/,stocks
Are diversified equity portfolios effectively inflation-resistant long term?,"I've always worked off the assumption that equities/stocks are about as inflation proof as any asset/investment you can own, except for maybe gold and real estate. My likely flawed reasoning is that although inflation may adversely impact a company's profitability, the price of the stock will mostly go up over time as inflation impacts it because most of the assets of the entity will also increase from inflation. I'm effectively 100 percent invested in the S&P 500 and plan to stay that way for a while as my investment horizon is about 20 years.

How bad is my understanding of this?",1751309974.0,https://www.reddit.com/r/stocks/comments/1log153/are_diversified_equity_portfolios_effectively/,stocks
Found a mysterious unclaimed very old stock,Not sure if this is the right subreddit to post in but I was cleaning my house recently and I found a stock that my grandfather purchased in 1944. It is 1 share in Brown County Cooperative Association (a farmers co op in aberdeen sd). I have been trying to find the co op online to see if it is worth anything but when I spoke to the county office they said it had disbanded. Is it worth pursuing this further or should I just give up on it? I can include a picture of the certificate if that would be helpful just not sure what information is relevant. ,1751237561.0,https://www.reddit.com/r/stocks/comments/1lns0xi/found_a_mysterious_unclaimed_very_old_stock/,stocks
SOFI is dumb money bait and that’s why I brought it.,"I don’t believe in the product. No differentiated edge. 

But the narrative is sticky: crypto, retail-friendly lending & investing, post-IPO comeback story.

This is a Robinhood echo play. And people love a comeback more than a balance sheet tbh.

Perception matters more than reality and the perception of a perfect complement to Robinhood is irresistible for retail.

It’s up 50%+ from April lows and building momentum.

Many will pretend they are too smart to chase it, and that’s exactly why this play works.",1751345901.0,https://www.reddit.com/r/stocks/comments/1lot4a3/sofi_is_dumb_money_bait_and_thats_why_i_brought_it/,stocks
Name that indicator,"Looking for the name of an indicator I have seen on TOS previously. It was used to show what the implied price movement on the day was estimated to be in total +/-. I can not for the life of me remember what it was called. Also, bonus points if you know what it is on RH legend. I am just playing with the platform now for the first time. ",1751283544.0,https://www.reddit.com/r/stocks/comments/1lo5a4a/name_that_indicator/,stocks
Stocks for The Big One,"There’s always talk about not if but when a massive earthquake were to occur on the West Coast of the U.S. I’m not necessarily trying to time something or make a portfolio centered around the idea. However, I do want ideas or input from others: what companies would benefit more than most in the event The Big One were to hit?",1751252957.0,https://www.reddit.com/r/stocks/comments/1lnx3og/stocks_for_the_big_one/,stocks
"Daily General Discussion and Advice Thread - July 01, 2025","Have a general question? Want to offer some commentary on markets? Maybe you would just like to throw out a neat fact that doesn't warrant a self post? Feel free to post here!

Please consider consulting our FAQ first - [https://www.reddit.com/r/investing/wiki/faq](https://www.reddit.com/r/investing/wiki/faq) And our [side bar](https://www.reddit.com/r/investing/about/sidebar) also has useful resources.

If you are new to investing - please refer to Wiki - [Getting Started](https://www.reddit.com/r/investing/wiki/index/gettingstarted/)

The reading list in the wiki has a list of books ranging from light reading to advanced topics depending on your knowledge level. Link here - [Reading List](https://www.reddit.com/r/investing/wiki/readinglist)

The media list in the wiki has a list of reputable podcasts and videos - [Podcasts and Videos](https://www.reddit.com/r/investing/wiki/medialist)

If your question is ""I have $XXXXXXX, what do I do?"" or other ""advice for my personal situation"" questions, you should include relevant information, such as the following:

* How old are you? What country do you live in?
* Are you employed/making income? How much?
* What are your objectives with this money? (Buy a house? Retirement savings?)
* What is your time horizon? Do you need this money next month? Next 20yrs?
* What is your risk tolerance? (Do you mind risking it at blackjack or do you need to know its 100% safe?)
* What are you current holdings? (Do you already have exposure to specific funds and sectors? Any other assets?)
* Any big debts (include interest rate) or expenses?
* And any other relevant financial information will be useful to give you a proper answer.

Check the resources in the sidebar.

Be aware that these answers are just opinions of Redditors and should be used as a starting point for your research. You should strongly consider seeing a registered investment adviser if you need professional support before making any financial decisions!",1751356890.0,https://www.reddit.com/r/investing/comments/1lovyde/daily_general_discussion_and_advice_thread_july/,investing
Who was the investor in the 90s who fled from America to Switzerland?,"I remember as a kid there being some guy on the news who made a shit ton, and fled with all he made to Switzerland. Believe he was a hedge fund manager. Since in Switzerland tax evasion is a misdemeanor he just paid the government a much smaller fine while securing Swiss citizenship.

I do not know what happened. I just remember a bunch of people on Wall Street being extremely pissed. Anyone know who this might be? ",1751384178.0,https://www.reddit.com/r/investing/comments/1lp4uc3/who_was_the_investor_in_the_90s_who_fled_from/,investing
How do you guys know when to sell?," what makes you guys sell? Im buying stocks I think will outperform but im still comfortable holding them long term beyond the next 12 months. So im not sure as to when I should be selling them with reasons other than to just cash out for example. Advice is appreciated, thanks ",1751392307.0,https://www.reddit.com/r/investing/comments/1lp8feo/how_do_you_guys_know_when_to_sell/,investing
Is there any benefit in owning VTI vs VONG or is it worth owning both?,"Pretty much the title. Between VTI and VONG, is it worth having one over the other or even having both in your portfolio? I don't know a whole lot, but from I can tell, the answer is no because they've tracked extremely similarly over the last decade and their top 10 holdings are all roughly the same. My goal is to buy and continue investing as I can and hold onto these for a few decades and then maybe I'll have something worth cashing out at that point. Like I said, I don't know a whole lot so I am just trying to do my due diligence and make sure I am doing the ""right"" thing. Thanks. ",1751388087.0,https://www.reddit.com/r/investing/comments/1lp6jsd/is_there_any_benefit_in_owning_vti_vs_vong_or_is/,investing
diversification of my traditional IRA,New here.  Hello.  I recently retired from working.  I'm 63 and my company sponsored 401K was rolled over into a traditional IRA a few months ago at my credit union.  The rate of return is disappointing.  Can i invest part of my IRA into a higher interest savings CD without incurring a tax penalty?,1751369808.0,https://www.reddit.com/r/investing/comments/1lozcfw/diversification_of_my_traditional_ira/,investing
How do you allocate across retirement and personal accounts?,"I have 1/3 of my investments in tax advantaged accounts and 2/3 in a taxable account. 

It’s time for me to rebalance. My bond allocation is 8% and my target is 16%. 

I could buy/sell in the tax advantaged accounts and pay no taxes now. But over time that will probably mean more bonds and low risk assets in the taxable accounts advantaged accounts (assuming the economy grows over the next 20 years). 

Is it a better idea to try and keep my higher risk/return investments in my tax advantaged accounts? Even if it means selling at a gain and paying taxes in my taxable account?

Or do you all balance every account to your targets? Or have different targets for taxable and tax advantaged accounts? 

Also 100% possible I’m overthinking this. ",1751383826.0,https://www.reddit.com/r/investing/comments/1lp4oq9/how_do_you_allocate_across_retirement_and/,investing
Alternative Investment Strategy besides going all in buying the dip and DCA,"Let's say I'm really bullish on HOOD and I have $100k cash to invest now. 

Instead of putting all $100k into HOOD at its near all-time-high, or, instead of putting $10k into HOOD every 2 weeks for the next 5 months, what if... I put all $100k into VTI right now, and then whenever there's a dip (let's say 10%), I swap some of the VTI out and into HOOD and do that several times - what are your thoughts on this strategy? 

The idea is whenever there's a dip, when VTI goes down 10%, HOOD would likely go down much more, like 30%, because individual stocks are more volatile than total market fund, especially risk asset like HOOD. I know this is like timing the market, but I'm thinking this is doing it in a slightly different way where I'm still invested in VTI while I wait and not out of the market completely with a load of cash. At the same time I can profit from the difference in volatility between VTI and HOOD should a dip take place.

Now please tell me what are all the things that could go wrong with this strategy. ",1751389970.0,https://www.reddit.com/r/investing/comments/1lp7e2y/alternative_investment_strategy_besides_going_all/,investing
"First time doing a private placement real estate investment, is there anything I'm missing?","I'm looking to add about 10-15% real estate to my portfolio. I've been offered access to a private placement funding two buildings of student housing attached to a college. There are about 250 units and almost all are currently paying rent.

To be clear, I'm only looking to invest the minimum in this one (50k) until I make sure I didn't miss anything. I have about 3mm in my portfolio plus a house and an income of 250k base and 550k semi-illiquid stock a year. (I count this stock as worth zero even though it's in a very solid company). My wife also works. My portfolio is mostly VTI with about 25% international stocks and 5% gold. I'm looking to retire in 20 years.

The private placement has a ten year lockup and a projected IRR of 13.5% after the company gets their share. I'd get small rent payments quarterly with a lump sum after five years and a bigger lump sum when they sell or recapitalize the properties after 10 years. I'm guaranteed the first 9% of any money made before the company gets anything. They also offer 9% interest until the placement closes in October.

The person behind the placement has a solid 20 year history of these projects in this area and the average IRR on his placements is 19% - this one is considered much more conservative because the properties are already full of students paying rent, thus the lower IRR.

My understanding is that the rent payments can be tax deferred due to depreciation. Is this correct?

What I'm wondering is: what don't I know? The numbers seem reasonable given the fact that it's an illiquid investment that I can't cash out for ten years but I don't mind that because I'm saving for retirement in 20.

Obviously there are some catastrophic risks like fraud, embezzlement or just the college going out of business but I can afford to lose the full 50k if this happened. Is the rate of return worth the lock up and the lack of geographical diversification? It seems like a reasonable anti-recession strategy - people actually increase college attendance when the economy sucks.

Anything else I should be thinking of?",1751386254.0,https://www.reddit.com/r/investing/comments/1lp5qtr/first_time_doing_a_private_placement_real_estate/,investing
Any experience with Self Storage Funds?,"I’ve kicked the tires on one or two funds that have the same basis value plan- acquire self storage units, improve the revenue, combine them, exit in a few years. They all promise approximately the same quarterly returns and then significant upside on exit. 

Has anyone successfully invested in one of these? I’m just curious if they really are so solid and, if so, why people aren’t falling over themselves to invest in them. ",1751385791.0,https://www.reddit.com/r/investing/comments/1lp5jfy/any_experience_with_self_storage_funds/,investing
Roth IRA or 529 - PhD student,"Hi guys/guylettes,

I'm a 1st year PhD student (underpaid) and for this conversation I want to assume I can only contribute equal amounts to one or the other (can split in half but).

Is it more worthwhile to make a 529 and then pay rent/travel expenses (if applicable?) with the money earned from that account IN THE NEXT 4 YEARS, or would it be better to just put all the money into a Roth IRA?

I have a 529 with no money in it at the moment and I was thinking if I put maybe 6-10k in it, over a year I can possibly get a month, maybe two, worth of rent, free, during the rest of my time being a PhD student.",1751384497.0,https://www.reddit.com/r/investing/comments/1lp4za1/roth_ira_or_529_phd_student/,investing
Can I get congressional PTRs (periodic transaction reports) emailed to me automatically?,"People talk about the NANC etf as a “simplied” option to track congressional trading. However this has a high expense ratio. 

I’m wondering if the PTR reports can be set up to automatically be sent to my email whenever they are filed and then just “follow” the trades based on what I read myself? Or do I have to search every month to see if a new one has been filed?",1751383064.0,https://www.reddit.com/r/investing/comments/1lp4cm0/can_i_get_congressional_ptrs_periodic_transaction/,investing
US bond correlation with equties,"Do short term US bond like VDST and BOXX correlate with US market corrections / crashes? I am parking most of my money in these bonds and in Emerging and Developed (ex-US) Markets ETFs while waiting for US market corrections / crashes since the latter is at all time high. 

These bonds give me 5% / year interest and they mature from 1 month to a year.

Also, what percentage of bond vs  total assets should I allocate of I will FIRE in a year, I am middle aged.

Thanks.",1751378977.0,https://www.reddit.com/r/investing/comments/1lp2nls/us_bond_correlation_with_equties/,investing
DCA on SPY : Daily VS Monthly (Backtested Results),"So I was curious to see if a daily DCA made a big difference VS a monthly DCA over the long run.

I thus made a backtest on both DCA strategies: [https://imgur.com/a/uTHjAHO](https://imgur.com/a/uTHjAHO)

**Daily DCA:**  
Total return (2005-2025) : +217%  
Number of transactions : 5022

**Monthly DCA:**  
Total return (2005-2025) : +216.52%  
Number of transactions : 239

Conclusion: if you're in it for the long haul, spare yourself the trouble of very frequent DCA. The difference will be negligible.

Happy to discuss the results with you all!",1751295315.0,https://www.reddit.com/r/investing/comments/1lo9mbm/dca_on_spy_daily_vs_monthly_backtested_results/,investing
Passive income with HYSA or SGOV in WA. What do you use,"Sgov- state and local tax exempt
HYSA - no state tax I live in WA

Should I just go for a HYSA or…? I use my brokerage account for 401k, Roth and investing so I feel like I should just park it in my brokerage account instead of opening another account with a different bank for HYSA? I don’t NEED it to be instantly liquid… was just going to use it just as passive income for extra $400-$500 a month if I invest 120k

I really can’t decide as it’s not FDIC insured but if SGOV goes to shit I don’t think FDIC is going to do much either as it’s backed my by US… ?

Also doesn’t HYSA just invest in treasury bills anyways so it’s the same thing but through a big company when I can just have it all in my hands. The rate different will most likely be half a percent sgov va HYSA. So at the end of the day it really is barely different 

Just wanted some inputs on what you use and why?
",1751323833.0,https://www.reddit.com/r/investing/comments/1lolso8/passive_income_with_hysa_or_sgov_in_wa_what_do/,investing
Nu Holdings Ltd.(NYSE:NU) added to Russell Top 200 Growth Index,"Good news! What this means... Many exchange-traded funds (ETFs) and other investment products are designed to track the Russell Top 200 Growth Index. When a company is added to the index, these funds automatically buy shares of the new addition, leading to increased demand for the stock and potentially driving up its price.",1751286980.0,https://www.reddit.com/r/investing/comments/1lo6enz/nu_holdings_ltdnysenu_added_to_russell_top_200/,investing
