title,text,created_utc,url,subreddit
You are exit liquidity - Pt 2,"The last time I posted we were a few days from bloody liberation day.

This time we're staring down a large number of unemployment and the delayed realization of tariff impacts at grocery store. From January to May 2025, U.S. companies across sectors announced approximately 696,000 job cuts, this does not even count the people who were pipped/fired from corporations to avoid paying severance (yes this happens and it is pretty shitty).

How does this affect the stock market?

According to Vanguard and Fidelity 2024 data:

* Total average contributions from both employee + employer: \~$11,000–$13,000/year

Lets just pull 580k out of our asses and do a bit of math.

580k Jobs \* $900 contributions a month = $522 Million a month.

Combine this with the fed's definition of unemployment which excludes those working uber or doordash to make ends meet:

* Underemployment: The official unemployment rate classifies anyone working at least one hour a week as employed, regardless of whether it's part-time, temporary, or below their skill level. This can distort the picture, as many people may be struggling financially despite being counted as employed.

The fed only surveys 60k households a month to get a rough estimate of unemployment numbers. 

In my honest opinion....

Liquidity has been high because everyone is positioning themselves after triple witching day. Retail who got laid off received their 401k and re-invested into the stock market. 

Layoffs are at an all time high and continuing, unemployment is completely understated. The financial structure sits on a foundation of Jenga blocks with the fed propping it up. The question is not how high it can go, its how long before we sustain a prolonged crash. I am honestly just writing this because I have nobody else to talk to about investing. If you have a discord channel please invite me. ",1751301242.0,https://www.reddit.com/r/stocks/comments/1loc6n4/you_are_exit_liquidity_pt_2/,stocks
Opendoor $275k Double Down,"Following up on my last Opendoor [post](https://www.reddit.com/r/wallstreetbets/comments/1kmaqin/opendoor_is_the_next_carvana/). I increased my $OPEN bet to $255k, up $20k today:

https://preview.redd.it/orioq6i4yaaf1.png?width=624&format=png&auto=webp&s=f2bdc89a76cefccd798bd377b06d376b7f04938a

After my last post Reddit put in at least $30M into this stock. Then the last 6 weeks sucked:

* 80M shares were shorted, 11% of total shares
* Delisted from Russell, etfs were forced to sell 4%+ of shares 
* Scary articles about Nasdaq delisting, reverse splits, shareholder lawsuits, layoffs, convertible bonds
* Fed refuses to lower rates
* Stock is down 20%

I still think it’s a great bet here, and none of that changes my outlook on the company. But I figure many of you bought in here just trying to catch a meme rally that fizzled out, and now you’re stuck with a stupid stock that’s down 20%. $30M is a lot of money, and some of you put in 6 figures. I wanted to give that crowd a balanced, less-jokey DD so you can decide if you want to keep this as an investment.

All the arguments from the first [post](https://www.reddit.com/r/wallstreetbets/comments/1kmaqin/opendoor_is_the_next_carvana/) are still true, go read that if you haven’t.

**Q2 Data Meets Guidance**

I pay for a data feed on Opendoor’s next quarter:

https://preview.redd.it/gd1kphd8yaaf1.png?width=1999&format=png&auto=webp&s=c73b0ad5edf57ded60e826aa0d458e1a3523fbf5

(Source: [datadoor.io](http://datadoor.io))

Q2 Guidance was for $1.35B - $1.45B sales and 4.5% - 4.9% contribution margin (i.e. margin after holding and sales costs). The data we have shows $1.26B through June 15, so as the next two weeks come in we’ll hit revenue guidance. Contribution margin is usually 4% less than gross margin, so we’ll also hit the margin guidance. Seems very likely we’re on track for management’s guidance of $0-$20M Ebitda profit, which would make this the first Ebitda profitable quarter in three years. There is a noticeable drop in sales in June. Opendoor is selling through its inventory hard, so I think this is dropping just because they have fewer houses to sell.

**Acquisitions**

Management guided in Q1, that they’ve decided to buy fewer houses in the Summer and more in the Winter. Houses have peak prices in the peak Summer months, and if Opendoor doesn’t flip them quickly it often has to hold them until next Spring and sell at a loss. Also, Opendoor knows this means house prices are going to drop this Fall:

https://preview.redd.it/ih2qqn0myaaf1.png?width=1890&format=png&auto=webp&s=46f0d45108c98d33327dc6e169fc56602572a678

A crash isn’t expected btw, HousingWire and Redfin have been saying things like 1-3% annual drops. Still, a 5-10% drop is a possibility. 

So they’re playing defense right now, buying ⅓ as many houses as last year:

https://preview.redd.it/f2e2j6nsyaaf1.png?width=623&format=png&auto=webp&s=627ed4237cec821040aba80b2966ad348dd5d637

It’s possible the shorts are seeing this data and think the company is in trouble. I think it’s a smart move. With low inventory this Fall they’re going to be protected from drops in house prices, and they’ll have cash to buy from distressed sellers this Winter. 

Lower acquisitions does mean revenue will drop a lot this Fall. Margins however will be much higher, because Opendoor is offering worse deals:

https://preview.redd.it/aa5m476xyaaf1.png?width=551&format=png&auto=webp&s=cd35a9b971e6db3ee0b99ebf3bd4236c757c8036

Also note there is a new agent referral program this Summer, where Opendoor is sending customers to local real estate agents and collecting referral fees. I talked to a real estate broker that’s very bullish about this, he tells me agents will pay half of their commissions just for a new lead. That program is almost certainly contributing to lowered acquisitions this Summer, but it’s likely being replaced with risk-free commission revenue. 

So to me the drop in acquisitions is good. We were told to expect this to protect the company against house price drops this Fall. The revenue drop will be offset by higher margins and referral fees. Expenses will also be much lower. I will be concerned if acquisitions don’t rise in Q4, but right now I think this is a good thing. 

**Inventory Health**

Holding times are way too long. The average house takes 142 days to sell, up from 117 last year.

https://preview.redd.it/230ukp4zyaaf1.png?width=1999&format=png&auto=webp&s=e7e57ca3991eafd22af51cf59ca2f4ac4c6256ee

They’ve sold through a ton of houses this quarter, and the remaining houses have good margins on average, so I’m not too concerned. It seems this is the result of buying too many houses in the Summer and being unable to sell them in the slow Fall and Winter seasons. This issue should be fixed now that they’re buying more in the Winter.

**Russell Rebalancing**

The Russell rebalancing thing happened. 83M net new shorts were added in the last few months:

https://preview.redd.it/0vxrt6u0zaaf1.png?width=1680&format=png&auto=webp&s=36d88ea8f1ec4115579a079a51bf1034f6103d09

At the end of the day on the 27th, about 100M shares were traded, including 62M at the closing auction:

https://preview.redd.it/ojoyzwii0baf1.png?width=1192&format=png&auto=webp&s=6962988dc0dcb1d1f347e10bd68d49dfe1069af8

That was the Russell etfs selling their shares to hedge funds, who presumably built up a big short position ahead of time so they wouldn’t be stuck with 62M $OPEN shares they have to sell. 

So now the shorting pressure should let up a bit now, since the hedge funds aren’t building up a huge short position in anticipation of this event. The stock is also becoming hard to borrow, shorts have to pay interest now:

https://preview.redd.it/ys8e3pw4zaaf1.png?width=1362&format=png&auto=webp&s=08d02ab9d495fc7517d46bcb91aa8bc5c730c168

All of that means the nonstop shorting pressure should at least slow down, which means this might be a bottom for the stock. No panic from the shorts though unfortunately. We will probably need a great Q2 and rates to lower for that to happen.

**Management Pay tied to Profit**

Some positive news: Executive pay in [April](https://investor.opendoor.com/static-files/31a16aba-1e47-4865-be1f-159d817bac35) got tied to company profits, which means the CEO’s pay is getting cut this year from $17M to $750k. The company also brought on new directors, a new CTO and an ex-Google CTO in November. Twitter’s former COO joined the board in June. It’s a good sign that quality people are still joining the company. 

**Opendoor Agent Program**

Opendoor finally did a [public release](https://www.opendoor.com/agents) of their new agent program I had mentioned. It’s a huge change. Opendoor fired or reassigned their internal sales team, 110 people, and are now sending local real estate agents to customers homes to help them decide if they actually want to sell to Opendoor or if they want to list normally. Opendoor and the agent both get a cut of the profit whatever the customer decides. Their website also shows this:

https://preview.redd.it/50xdryy6zaaf1.png?width=317&format=png&auto=webp&s=0ed302d0895736270bdbf7aa473a37cd690483fd

Which means the real estate agents are also going to be selling Opendoor-owned homes, possibly under their own brands.

Some investors aren’t going to like this, because Opendoor was the company that was supposed to get rid of real estate agents. I think it’s good, because Opendoor is kinda garbage at selling their homes. Like, did you guys know Opendoor doesn’t use for sale signs in some cities? Squatters figured out an Opendoor sign means the house is unoccupied, so Opendoor can’t put signs up. Opendoor also expects customers to download an app and do a self-guided tour of a house, which often turns out to be musty and unstaged. It’s high tech, some people probably like it, but older generations expect to be able to call someone up and do a house tour, and right now boomers are the only ones that can afford to buy houses. 

So sure, Opendoor will have to pay agents. Those costs are offset by firing their internal sales team. In return their houses will now have for sale signs, will be clean and staged with furniture, and will have an agent hustling to sell them. Resale values should go up and holding times should go down. This is very possibly a business-saving change. 

**Nasdaq Delisting & Reverse Split**

Opendoor got a Nasdaq delisting threat, because its share price has been below $1. $OPEN has to stay above $1 for 10 consecutive trading days by the end of November or it will get removed from Nasdaq, which would be stupid for a company with $6B annual sales. 

Management has 3 options:

1. Run the company better
2. Reverse Split
3. Share buyback

They’re been running the company better. Hopefully the market recognizes this by November. A share buyback is possible but unlikely, since Opendoor wants to preserve cash while the housing market is dead. 

That leaves a reverse split. Opendoor sent out a shareholder [vote](https://investor.opendoor.com/news-releases/news-release-details/opendoor-announces-preliminary-proxy-filing-seeking-approval) asking approval for a reverse split, if necessary, by November. Personally, if it happens, it’s not something that will bother me. I think a lot of people are upset because they think reverse splits mean dilution is coming. They had $693M cash in Q1 and will have more in Q2, they really don’t need to dilute here to raise cash. A reverse split would be embarrassing if the stock doesn’t recover by November, but imo the only damage is psychological.

**Zillow advertises Opendoor**

Virtually everyone in the US uses Zillow “Zestimate” of their home value. When they do, Zillow automatically pitches them an Opendoor offer:

https://preview.redd.it/vukwx2f9zaaf1.png?width=926&format=png&auto=webp&s=881bceae9644c9f6c8165182b4ec9b50095d3aa3

If they end up taking the offer, Opendoor pays a commission. It’s a huge marketing funnel for Opendoor, they get 40% of their customers through this channel.

Right now Opendoor can’t afford to make good offers, because the housing market is frozen and prices look ready to drop. When things stabilize more and Opendoor starts making better offers, this funnel could turn into a nice revenue multiplier.

**Bear Case**

Let’s imagine the worst-case scenario. Opendoor lost $392M last year. It’s very likely they’ll narrow that loss, but let’s suppose they only narrow it to $200M per year. Then let's suppose we get some inflation from tariffs and the Fed raises mortgage rates, causing house prices to drop 10% a year for the next two years. Despite positioning defensively, Opendoor incurs $150M in write downs and is out of cash by the end of 2026. 

Does the company have any terminal value in this scenario? I’ve heard from two people that work in institutional real estate that argued Opendoor would be bought out before it goes bankrupt. The company has a ton of assets: billions in homes, a pricing algorithm backed by a decade of data, the Zillow partnership, brokerage licenses in almost every state, relationships with real estate agents, home builders and repair contractors across the country. Both of these people agree Opendoor could be acquired for way more than $400M. 

**Conclusion**

Opendoor is a stupid San Francisco tech company that’s been learning how real estate works. This quarter they started working with real estate agents. Real estate agents are only good for putting signs in front of houses, staging them with furniture, and giving tours. Opendoor didn’t know how to do that because tech companies only know how to do apps and algorithms. But now they’ve learned new tricks like for sale signs, they’ll start making more money, and stock goes up.

In all seriousness though the new management seems competent. The company might blow up if we get more inflation and the Fed keeps rates high. But if they pull the comeback off, this is a tech company with a P/S of 0.07, it will be a stupid ROI.",1751393861.0,https://www.reddit.com/r/stocks/comments/1lp945r/opendoor_275k_double_down/,stocks
What are your thoughts on this enticing IPO,"Holtec International announced an IPO later this year. How do you think this shakes out? They are pretty forward thinking in the industry. Is this the next must buy? The government seems to have put a large amounts of chips into nuclear powers. I can’t imagine they 180 any time soon. 

https://neutronbytes.com/2025/06/28/holtec-ceo-says-firm-will-go-public/ Holtec CEO Says Firm Will Go Public | Neutron Bytes ",1751389783.0,https://www.reddit.com/r/stocks/comments/1lp7b1z/what_are_your_thoughts_on_this_enticing_ipo/,stocks
What is Meta's End Game giving away LLM,"I totally get Meta's investment in AI and LLM research since they put it to hard work in all of their products.  The result: more accurate targeting of marketing, better client profiling, automated flagging of hate speech, custom AI bots for customer campaigns, etc.

I don't understand why they also give the trained LLM's (i.e. Llama 4.0) away for free. Why share the secret sauce?  What is their end game for doing this?",1751339875.0,https://www.reddit.com/r/stocks/comments/1lorbpg/what_is_metas_end_game_giving_away_llm/,stocks
Oracle Hits Record High on Huge Cloud Deals  Is AI Hype Peaking?,"Oracle just hit a fresh record high after revealing multiple multi-billion dollar cloud services deals, with one expected to bring in $30B annually starting FY28. Stock jumped 5% today, adding to a monster 33% run this month alone

CEO Safra Catz said Oracle is off to a ""strong start"" for FY26, with MultiCloud database revenue growing 100%+. Meanwhile, analyst upgrades are rolling in. Stifel bumped Oracle from Hold to Buy, with a $250 price target citing cloud momentum

Some caution flags though: Oracle's massive $500B Stargate AI data center project with OpenAI and Softbank has stalled, and short seller Jim Chanos is calling out the broader AI hype as risky, comparing it to the dot-com bubble

Still, Oracle's investing heavily in data centers, with capex soaring from $6.9B in FY24 to $21.2B in FY25, and likely topping $25B this year

ORCL now up 4% midday at \~$219, on track for record close above $215

What do you think? More room to run or is this the AI hype cycle top?",1751307559.0,https://www.reddit.com/r/stocks/comments/1loezhe/oracle_hits_record_high_on_huge_cloud_deals_is_ai/,stocks
Circle applies for US trust bank license after bumper IPO,"https://www.reuters.com/sustainability/boards-policy-regulation/circle-applies-us-trust-bank-license-after-bumper-ipo-2025-06-30/

> June 30 (Reuters) - Stablecoin firm Circle is applying to create a national trust bank in the U.S., a major move after its blockbuster IPO valued the company at nearly $18 billion earlier this month.

> If the charter is granted by the U.S. Office of the Comptroller of the Currency, it would enable Circle to act as a custodian for its own reserves and hold crypto assets on behalf of institutional clients. Unlike traditional banks, the license would not allow Circle to take cash deposits or make loans.

> ""Circle has long sought to seek the highest standards of trust, transparency, governance, compliance,"" CEO Jeremy Allaire told Reuters in an interview. ""Becoming a publicly traded company is a significant part of that, becoming a national trust company is again a continuation of that.""",1751338846.0,https://www.reddit.com/r/stocks/comments/1loqziz/circle_applies_for_us_trust_bank_license_after/,stocks
"Canada has rescinded its digital services tax to advance US trade talks, which have now resumed","Futures are green on the news that Canada has rescinded its digital services tax to advance US trade talks

https://www.ctvnews.ca/world/trumps-tariffs/article/canada-rescinds-digital-services-tax-in-a-bid-to-advance-trade-talks-with-us/

> June 29 (Reuters) - Canada has rescinded its digital services tax in a bid to advance trade negotiations with the U.S., Canada’s finance ministry said in a statement on Sunday.
> 
> Canadian Prime Minister Mark Carney and U.S. President Donald Trump will resume trade negotiations with a view towards agreeing on a deal by July 21, 2025, the ministry said",1751250609.0,https://www.reddit.com/r/stocks/comments/1lnwdfx/canada_has_rescinded_its_digital_services_tax_to/,stocks
CD Projekt Red - surpasses 3.5x its price since mid '22. Witcher 4 around 2027 and another Cyberpunk is being worked on,"CDPR continues to go up since last post

CDPR went very significantly up after their lows around 80PLN

to 283PLN

On their roadmap there are two huge projects: Witcher 4 and another Cyberpunk - Orion.

Recently they stopped working on their own engine and moved to Unreal. This should decrease development cost, make roadmap more predictable and make it easier to onboard new employees.

Also they acquired The Molasses Flood - experienced, Boston based game studio.

They are also good at pushing their IPs outside e.g Edge Runners series

Witcher 4 has been in development for years and is expected to appear around 2027.",1751287443.0,https://www.reddit.com/r/stocks/comments/1lo6k5u/cd_projekt_red_surpasses_35x_its_price_since_mid/,stocks
Will there be a sharp pullback soon when some tariffs go into effect on July 8?,Is there going to be a sharp pullback soon like what we saw around April 7 and 8? Some tariffs are planned to go into effect July 8 when the 90 day pause is done. The markets seem to be irrational like usual. Should we expect like last time for everything to be on the up and up until tariffs are for sure a thing and then expect a 10% downturn over only a few days?,1751283680.0,https://www.reddit.com/r/stocks/comments/1lo5blf/will_there_be_a_sharp_pullback_soon_when_some/,stocks
Two situations that you need to understand - USD devaluation and Liquidity,"There are a few schools of thought here that say USD has devalued and hence stocks are increasing in value and then the second being the continuous influx of liquidity through 401k and other DCA contributions that is keeping the market floating (or rising in our case). Let's break this down

**1)** The quarterly rate of 401k and other retirement contributions has not changed by a lot - still at the 12-14% rate of income in the latest quarter too. Here is the thing - this has been consistent for years and people are missing the point that all recent and previous crashes and rallies continued to happen irrespective of this constant flow of money - So **stop imagining that this 401K money is keeping market up** \- **market is and has always moved disproportionate to this influx of 401k / DCA money** and there are larger players that impact the trend.

**2)** USD devaluation - yes USD is devaluing - example USD - EUR has dropped 10+% vs SPY is literally flat YTD (even after the big liberation week drop and post rally). This just means that SPY is 10% cheaper in the international market and still has room to grow in USD denomination markets (i.e. US Markets). **The only way the market rally breaks is if USD stabilizes making US stocks more expensive.** This has been a change in my thought recently.

**Positions:** Just bought SPY calls for 650 expiring Dec 2026 - rationale - expecting continued momentum and then a sharp drop - expecting to sell before the sharp drop (yes catching the dropping knife sometimes before September).",1751307966.0,https://www.reddit.com/r/stocks/comments/1lof5pk/two_situations_that_you_need_to_understand_usd/,stocks
Why the META narrative is underappreciated.,"This is my understanding of Zuckerberg's intent throughout Meta/Facebook's history.

1. Social Graph (2004-2011) - mapping real-world connections into digital form.
2. Data Extraction (2011-2018) - monetizing attention by modeling & manipulating behavior.
3. Platform Defense (2018-2022) - protect Meta's empire from regulators & competitive threats.
4. AI Bootstrapping (2022-2024) - training AI models using the world's richest behavioral dataset.
5. Interface Reinvention (2025-present)- building a new human-computer interface around persistent presence.
6. Sovereign AI (2025-present) - position Meta as a public-good default for everyday reasoning, commerce & relationships.

The last two appear to be parallel tracks that may eventually converge into Zuckerberg’s long-term vision: a persistent, AI-powered metaverse.

Zuckerberg is already moving aggressively - quietly assembling one of the strongest AI teams in the world, including talent responsible for key breakthroughs in open-source LLMs.

Most investors are still treating Meta like an ad business. Meta’s ad revenue is just the cashflow shell -  the real architecture being built is a sovereign operating system for human interaction.

Most won’t realize it until it’s already entrenched.",1751392530.0,https://www.reddit.com/r/stocks/comments/1lp8itp/why_the_meta_narrative_is_underappreciated/,stocks
"Oil price 5 days narrow range means it is preparing for something, right?","Based on daily WTI prices since 2021, it seems that 5 days of narrow range (e.g. using 5 days max/min) is biased toward price increase several days in the future. Today's data is 3% variation for 5 days, near low end of that dataset.

Have anyone done similar analysis or there are already known theories?",1751313016.0,https://www.reddit.com/r/stocks/comments/1lohbrq/oil_price_5_days_narrow_range_means_it_is/,stocks
New ETF will capitalize on Trump grift - aptly named GRFT,"It will analyze the congressional stock trade filings and take positions based on track record.

It will also look include companies that have a personal connection or influence on Trump.

I have a feeling this may be one of the best ETF ideas in a long time - who’s onboard?

https://www.etf.com/sections/news/new-etf-filing-aims-capitalize-government-grift",1751261314.0,https://www.reddit.com/r/stocks/comments/1lnzith/new_etf_will_capitalize_on_trump_grift_aptly/,stocks
IMAX bullish short term,"So I feel like we are going to get an increase in the stock price soon. IMAX is the best bang for your buck when going to see a movie in theatres. It doesn’t even compare to something like AMC. F1 released and shattered records by claiming 23% of the box office. The new Superman follows with a release on July 11th. No official ratings are out. According to ChatGPT, though, “online critics predict a strong score in the low‑70s range (% fresh), based on early impressions and director James Gunn’s pedigree.” With 2 good movies in line I believe IMAX is going to go up. It also has been trading somewhat sideways for a while just waiting for something to trigger.",1751380824.0,https://www.reddit.com/r/stocks/comments/1lp3efe/imax_bullish_short_term/,stocks
AI and Productivity gains ( which stock(s)) will benefit the most?,"Hypothetically say AI doesn't go to AGI or whatever.  Leave that out.  But say its VERY useful in automating just about every task (from legal to customer service).  

By earnings power only, which companies are most 'inefficient' now and will see monster benefits.

  
Part of me says BIG biotech will finally have its day in the sun due to their copious amounts of data/legal work.

  
Healthcare in general.....but are there other companies where its prime?  Maybe Berkshire and their insurance? ",1751373036.0,https://www.reddit.com/r/stocks/comments/1lp0esn/ai_and_productivity_gains_which_stocks_will/,stocks
