title,text,created_utc,url,subreddit
Rate My Portfolio - r/Stocks Quarterly Thread June 2025,"Please use this thread to discuss your portfolio, learn of other stock tickers & portfolios like [Warren Buffet's](https://buffett.online/en/portfolio/), and help out users by giving constructive criticism.

Why quarterly?  Public companies report earnings quarterly; many investors take this as an opportunity to rebalance their portfolios.  We highly recommend you do some reading:  Check out our wiki's list of [relevant posts & book recommendations.](https://www.reddit.com/r/stocks/wiki/index/#wiki_relevant_posts.2C_books.2C_wiki_recommendations)

You can find stocks on your own by using a scanner like your broker's or [Finviz.](https://finviz.com/screener.ashx)  To help further, here's a list of [relevant websites.](https://www.reddit.com/r/stocks/wiki/index/#wiki_relevant_websites.2Fapps)

If you don't have a broker yet, see our [list of brokers](https://www.reddit.com/r/stocks/wiki/index/#wiki_brokers_for_investing) or search old posts.  If you haven't started investing or trading yet, then setup your [paper trading to learn basics like market orders vs limit orders.](https://www.reddit.com/r/stocks/wiki/index/#wiki_is_there_a_way_to_practice.3F)

Be aware of [Business Cycle Investing](https://eresearch.fidelity.com/eresearch/markets_sectors/sectors/si_business_cycle.jhtml?tab=sibusiness) which Fidelity issues updates to the state of global business cycles every 1 to 3 months (note: Fidelity changes their links often, so search for it since their take on it is enlightening).  [Investopedia's take on the Business Cycle](https://www.investopedia.com/articles/investing/061316/business-cycle-investing-ratios-use-each-cycle.asp).

If you need help with a falling stock price, check out Investopedia's [The Art of Selling A Losing Position](https://www.investopedia.com/articles/02/022002.asp) and their [list of biases.](https://www.investopedia.com/articles/stocks/08/capital-losses.asp)

Here's a list of all the [previous portfolio stickies.](https://www.reddit.com/r/stocks/search?q=author%3Aautomoderator+title%3A%22Rate+My+Portfolio%22&restrict_sr=on&sort=new&t=all)",1748768419.0,https://www.reddit.com/r/stocks/comments/1l0kgkw/rate_my_portfolio_rstocks_quarterly_thread_june/,stocks
"r/Stocks Daily Discussion & Technicals Tuesday - Jul 01, 2025","This is the daily discussion, so anything stocks related is fine, but the theme for today is on technical analysis (TA), but if TA is not your thing then just ignore the theme.

Some helpful day to day links, including news:

* [Finviz](https://finviz.com/quote.ashx?t=spy) for charts, fundamentals, and aggregated news on individual stocks
* [Bloomberg market news](https://www.bloomberg.com/markets)
* StreetInsider news:
  * [Market Check](https://www.streetinsider.com/Market+Check) - Possibly why the market is doing what it's doing including sudden spikes/dips
  * [Reuters aggregated](https://www.streetinsider.com/Reuters) - Global news

-----

**Technical analysis (TA)** uses historical price movements, real time data, indicators based on math and/or statistics, and charts; all of which help **measure the trajectory of a security.**  TA can also be used to interpret the actions of other market participants and predict their actions.
        
The main benefit to TA is that everything shows up in the price (commonly known as **""priced in""**):  All news, investor sentiment, and changes to fundamentals are reflected in a security's price.

TA can be useful on any timeframe, both short and long term.

Intro to technical analysis by [Stockcharts chartschool](https://stockcharts.com/school/doku.php?id=chart_school:technical_indicators:introduction_to_technical_indicators_and_oscillators#benefits_and_drawbacks_of_leading_indicators) and their [article on candlesticks](https://stockcharts.com/school/doku.php?id=chart_school:chart_analysis:introduction_to_candlesticks)

If you have questions, please see the following word cloud and click through for the wiki:

[Indicator - Trade Signals - Lagging Indicator - Leading Indicator - Oversold - Overbought - Divergence - Whipsaw - Resistance - Support - Breakout/Breakdown - Alerts - Trend line - Market Participants - Moving average - RSI - VWAP - MACD - ATR - Bollinger Bands - Ichimoku clouds - Methods - Trend Following - Fading - Channels - Patterns - Pivots](https://www.reddit.com/r/stocks/wiki/ta-themed-post)

See our past [daily discussions here.](https://www.reddit.com/r/stocks/search?q=author%3Aautomoderator+%22r%2Fstocks+daily+discussion%22&restrict_sr=on&sort=new&t=all)  Also links for:  [Technicals](https://www.reddit.com/r/stocks/search?q=author%3Aautomoderator+title%3Atechnicals&restrict_sr=on&include_over_18=on&sort=new&t=all) Tuesday, [Options Trading](https://www.reddit.com/r/stocks/search?q=author%3Aautomoderator+title%3Aoptions&restrict_sr=on&include_over_18=on&sort=new&t=all) Thursday, and [Fundamentals](https://www.reddit.com/r/stocks/search?q=author%3Aautomoderator+title%3Afundamentals&restrict_sr=on&include_over_18=on&sort=new&t=all) Friday.",1751362229.0,https://www.reddit.com/r/stocks/comments/1lox95m/rstocks_daily_discussion_technicals_tuesday_jul/,stocks
Elon To Oversee Tesla's European Sales After Firing Omead Afshar,"Source: [https://finance.yahoo.com/news/musk-oversee-teslas-europe-us-132132604.html](https://finance.yahoo.com/news/musk-oversee-teslas-europe-us-132132604.html)

Reads: The source of the problem believes he will be the source of the solution.

No more comparing Tesla's brand damage issue to Bud Light. This is the equivalent of putting Mulvaney in charge of subsequent clean up job. The thing that amazes me most, is that Elon is completely unaware that the problem is **him**. He blamed Afshar as if he could have done something more, fired him (and the entire PR departement a while back if you remember), then with his planet sized ego, puts himself in charge of the problem he needlessly created. What does he think he is going to do? Convince all of Europe to see things his way and change their entire culture to suit his whack-a-doodle views? In his mind, are they all going to be doing the elbowless waves to idolize him by the end of Q3?

Simultaneously, he is now trying to take on the entire US government by going after both sides of the aisle. At what point does the market realize Elon has completely lost his mind? He is clearly having some sort of delusions about taking over the world. His cult followers that were the only ones allowed to ride in the staged Robotaxi ""launch"" understood their mission from their leader. Unless you want to hear a 15-minute Tesla pump session, just skip to the 18:00 mark on this video when he gets out:

(can't post YouTube vids, but see ""I SURVIVED A TESLA ROBOTAXI RIDE (BARELY)"")

Transcript: ""*I'm feeling pretty bullish. I think I am going to buy the stock. This company is about to take over the world I think...*""

They aren't even being subtle about it anymore. They are just telling people to buy the stock because a few select social media influencers were given highly controlled rides and a clear mission to pump. It all seems so desperate. Elon purchased Twitter to build his influence and I speculate somewhere around 10% of his 221+ million followers have had their brain turned to mush by Grok. That is a lot of people that can pump this meme stock. And they probably do think Elon will take over the world and will put their last pennies into that fantasy. Does anyone think that a staged social media campaign based on pure nonsense is enough to keep this stock in absurd P/E range that it has held in at for such a long time?

At what point is the board of Tesla liable to the shareholders for allowing this sort of behavior to continue? I guess they are all too busy selling their shares as fast as their agreements allow them to. Seriously, does anyone look at the insider trading activity and recent high-level departures of this company as have any doubts as to what is going on inside this rapidly failing company?

\*I hold TSLZ right now. And I think the collapse of this meme stock is near.",1751380971.0,https://www.reddit.com/r/stocks/comments/1lp3gle/elon_to_oversee_teslas_european_sales_after/,stocks
Australia's $6 Trillion Iron Ore Discovery Set to Transform Global Markets,"https://oilprice.com/Metals/Commodities/Australias-6-Trillion-Iron-Ore-Discovery-Set-to-Transform-Global-Markets.html


Australia’s $6 trillion iron ore discovery will boost supply and likely lower global iron ore prices. 

A new Rio Tinto and China Baowu Joint venture mine will add even more output, keeping Australia the top supplier while China stays the biggest buyer.

Lower iron ore prices mean cheaper steel, which helps US companies like GM and Ford cut vehicle production costs. 

Nucor and US Steel can benefit too, as cheaper raw materials can improve their profit margins and make their steel more competitive. 

Overall, lower iron ore prices can lift earnings for automakers, machinery makers, and steel producers, supporting share prices if other costs stay stable.",1751372145.0,https://www.reddit.com/r/stocks/comments/1lp03t6/australias_6_trillion_iron_ore_discovery_set_to/,stocks
Trump Takes Aim at Musk Over EV Subsidies; Tesla Shares Slump,"Bloomberg) -- President Donald Trump lashed out at Elon Musk on Tuesday, accusing the Tesla Inc. and SpaceX chief executive officer of benefiting excessively from government electric vehicle subsidies. Tesla shares tumbled.

“Elon may get more subsidy than any human being in history, by far, and without subsidies, Elon would probably have to close up shop and head back home to South Africa,” Trump said in a Truth Social post. 

“No more Rocket launches, Satellites, or Electric Car Production, and our Country would save a FORTUNE. Perhaps we should have DOGE take a good, hard, look at this? BIG MONEY TO BE SAVED!!!,” he added.

This comes after Musk slammed the US Senate’s latest version of Trump’s multi-trillion dollar tax bill, warning that the cuts to EV and other clean energy credits would be “incredibly destructive” to the country. Tesla shares slumped 5.8% in European premarket trading on Tradegate.

Tesla has benefitted from a popular $7,500 consumer tax credit for electric vehicles that Trump’s bill will eliminate. The automaker is set to release second-quarter sales later this week that will likely show a further slump in demand.

“Elon Musk knew, long before he so strongly Endorsed me for President, that I was strongly against the EV Mandate,” Trump said. “It is ridiculous, and was always a major part of my campaign. Electric cars are fine, but not everyone should be forced to own one.”",1751356761.0,https://www.reddit.com/r/stocks/comments/1lovx48/trump_takes_aim_at_musk_over_ev_subsidies_tesla/,stocks
How will the stock market react if Powell is replaced and rates are set to whatever Trump wants?,"Powells term ends in May of 2026, and it looks likely that his replacement could be a puppet for Trump. Trump has always been a proponent of low rates, recently suggesting that the fed fund rate should be cut 10 times, or 250 basis points lower. If the fed chair is replaced and rates are cut by such a large amount, will there be a sell off or will the low rates juice up the stock market like in 2020?",1751337598.0,https://www.reddit.com/r/stocks/comments/1loql4d/how_will_the_stock_market_react_if_powell_is/,stocks
What are the odds that Tesla posts god awful deliveries tomorrow and absolutely rockets?,"I feel like i've seen this movie before. I really want to short between the deliveries and antics with trump. On the flipside, my intuition tells me based on what happens every quarter, they will come out and say ""look guys, we actually sold negative cars, i'm not sure how, but thats what the numbers say... it is what it is"" - gap up %10... ",1751391855.0,https://www.reddit.com/r/stocks/comments/1lp88c0/what_are_the_odds_that_tesla_posts_god_awful/,stocks
Trump Oversees Worst Dollar Start to Year in Over Half a Century,"https://www.newsweek.com/trump-oversees-worst-dollar-start-year-over-half-century-2092446

T The U.S. dollar has had its worst start to a year since 1973, weighed down by President Donald Trump's trade policy, a worsening outlook for the country's ever-growing public debt, and concerns about the independence of the Federal Reserve.

The Financial Times reported that the U.S. Dollar Index had declined by 10 percent over the course of 2025, marking the weakest performance since the end of the Bretton Woods system, which was underpinned by the dollar's convertibility to gold.

Trump has staked much of his political reputation on his handling of the economy, pitching himself as the leader who can slash household bills, put more money in Americans' pockets through lower taxes, and lift commerce into a new golden age.

The dollar news coincides with the U.S. Senate gearing up to pass Trump's much-tweaked One Big Beautiful Bill Act, the tax-cutting provisions of which are set to expand the deficit by trillions of dollars over the coming decade, putting pressure on the dollar.",1751311149.0,https://www.reddit.com/r/stocks/comments/1logjlz/trump_oversees_worst_dollar_start_to_year_in_over/,stocks
Why you shouldn't be sitting out - most gains happen in a few explosive days.,"70%+ of long-term equity returns come from <10% of trading sessions.

Miss the top 10 days in a decade, and your annualized return gets cut in half.

Sitting out means statistically high odds of missing the meta shift (AI) that is driving this next cycle.",1751341702.0,https://www.reddit.com/r/stocks/comments/1lorvmw/why_you_shouldnt_be_sitting_out_most_gains_happen/,stocks
US dollar suffers worst start to year since 1973,"The US dollar is headed for its worst first half of the year since 1973, as Donald Trump’s trade and economic policies prompt global investors to rethink their exposure to the world’s dominant currency. The dollar index, which measures the currency’s strength against a basket of six others including the pound, euro and yen, has slumped more than 10 per cent so far in 2025, the worst start to the year since the end of the gold-backed Bretton Woods system. “The dollar has become the whipping boy of Trump 2.0’s erratic policies,” said Francesco Pesole, an FX strategist at ING.

  
[https://www.ft.com/content/59c07f63-3331-462b-b9e3-d1bcaea69fce](https://www.ft.com/content/59c07f63-3331-462b-b9e3-d1bcaea69fce)",1751293523.0,https://www.reddit.com/r/stocks/comments/1lo8vug/us_dollar_suffers_worst_start_to_year_since_1973/,stocks
Cramer has gone off the deep end!,"I watch Cramer every weekday evening, usually just the opening monologue while eating dinner.   He has his take on the news of the day, and it usually somewhat sensible.

Not today!    All those story stocks with ridiculous products that young investors are buying - better load up!   Forget interest rates, forget profits, buy the companies of the future who will sell what has not yet been invented!    

He even mentioned how much money he made in the dot-com era, and said the current market is just as hot.   

What he forgot to mention is that this is outright greater-fool gambling, taking the money of naive young investors before the bubble pops.   I'm sure he did the same thing in the dot-com era, but as a hedge fund manager he knew when to close positions and cash out.   

I'm thinking the crash must be near - what do you think?   Probably a lot of fraud, too.",1751332525.0,https://www.reddit.com/r/stocks/comments/1loow37/cramer_has_gone_off_the_deep_end/,stocks
"Home Depot targets contractors, is acquiring GMS for $4.3 billion","[https://www.ft.com/content/b928b594-117f-411a-acd7-3f4f1449dfc3](https://www.ft.com/content/b928b594-117f-411a-acd7-3f4f1449dfc3)

[https://www.bnnbloomberg.ca/business/2025/06/30/home-depot-targets-contractors-rivals-with-u43-billion-deal-for-gms/](https://www.bnnbloomberg.ca/business/2025/06/30/home-depot-targets-contractors-rivals-with-u43-billion-deal-for-gms/)

Home Depot said Monday unit SRS Distribution has agreed to acquire specialty building products distributor GMS for about $4.3 billion, stepping up its efforts to capture more demand from professional contractors.

Home Depot's SRS Distribution has outbidded the $5 billion hostile takeover attempt by QXO, led by billionaire Brad Jacobs. The deal including the debt, valued at $5.5 billion, offers $110 per GMS share, a 36% premium over its June 18 price. GMS shares rose 11.8% to $108.83.

The acquisition strengthens SRS’s network with over 1,200 locations and 8,000 trucks, targeting professional contractors as homeowner spending on renovations declines. The deal, following Home Depot’s $18.25 billion SRS purchase, is set to close by fiscal 2025, funded by cash and debt.",1751377462.0,https://www.reddit.com/r/stocks/comments/1lp21rv/home_depot_targets_contractors_is_acquiring_gms/,stocks
"AG on CNBC; Archer CEO Talks Air Taxi Rollout, Defense Spending & What’s Next for Urban Flight","Just watched Adam Goldstein on CNBC’s The Exchange and the guy is locked in. Archer isn’t just pitching hype anymore, this was a grounded update on where the company is headed.

AG directly addressed the usual skepticism (no revenue, pre certification, etc.) and basically said: yeah, it’s early but the foundation is built. This isn’t just a “flying car” concept anymore. The moves are real.

If they hit their 2025 milestones, ACHR could go from speculative to institutional darling fast

https://www.cnbc.com/video/2025/06/30/archer-aviation-ceo-on-air-taxi-plans-defense-spending-and-future-of-air-travel.html",1751377092.0,https://www.reddit.com/r/stocks/comments/1lp1wq3/ag_on_cnbc_archer_ceo_talks_air_taxi_rollout/,stocks
July 1 2025 - Growth to Dividend Reversal?,"Anyone else seeing this in their portfolios? I'm about 50/50 between growth and dividend aristocrats in my largest...and all my growth stocks are down single digits and all my dividend stocks are inverse and it's within $45 on a <$1M. Its the oddest thing.

Was there someone pumping dividend stocks all of a sudden?",1751383377.0,https://www.reddit.com/r/stocks/comments/1lp4hm0/july_1_2025_growth_to_dividend_reversal/,stocks
"U.S. to restart trade negotiations with Canada immediately, White House says","https://www.cbc.ca/news/politics/u-s-to-restart-trade-negotiations-with-canada-immediately-white-house-says-1.7574146

> The United States will restart trade negotiations with Canada immediately after Canada scrapped its digital services tax targeting U.S. technology firms, White House economic adviser Kevin Hassett said on Monday.
 
> ""Absolutely,"" Hassett said on Fox News when asked about the talks restarting. U.S. President Donald Trump asked the Canadians to take the tax off at the G7 meeting in Canada, he said.

> ""It's something that they've studied, now they've agreed to, and for sure, that means that we can get back to the negotiations.""",1751296668.0,https://www.reddit.com/r/stocks/comments/1loa7mt/us_to_restart_trade_negotiations_with_canada/,stocks
UnitedHealth Group up?,I suspect it’s due to ESPP acquisition date but am not an expert with analysis by any means. His hasn’t been this high since May 13th. Has anyone heard any other news or financial information or rumors that could be driving this surge? ,1751384558.0,https://www.reddit.com/r/stocks/comments/1lp507v/unitedhealth_group_up/,stocks
US bond correlation with equtities,"Do short term US bond like VDST and BOXX correlate with US market corrections/crash? I'm parking most of my money now here and in Emerging and Developed (ex-US) Markets ETFs while waiting for US market corrections.

Also, what percentage of bond vs total assets should I allocate of I will FIRE in a year, middle aged.

Thanks.",1751378472.0,https://www.reddit.com/r/stocks/comments/1lp2g96/us_bond_correlation_with_equtities/,stocks
TSLAQ2 Deliveries Slated at ~395K Vehicles (–11% YoY) as Musk Prioritizes AI & Robotaxi,"  
Q1 saw 336,681 deliveries; Q4 2024 record was 495,570 units

Q2 Delivery Estimate: \~395,328 vehicles, down \~11% year-over-year

AI/Robotaxi Focus: Elon Musk’s shift toward autonomous “robotaxi” projects may be diverting attention from core production ramp

**EV Demand Softness:** Broader market data points to cooling demand in key regions (e.g. Europe down 28% YoY in May)

**Production vs. Delivery:** Despite production increases, delivery shortfalls could pressure margins and pricing power this quarter

* With deliveries expected to dip below 400K, how might TSLA’s margin profile and pricing strategy be impacted?
* Is Musk’s heavy investment in AI and robotaxi technology a worthwhile long-term play, or does it risk operational distraction?
* Given mixed analyst estimates, do you see this as a buying opportunity ahead of the report or a signal to wait for concrete numbers?",1751326615.0,https://www.reddit.com/r/stocks/comments/1lomu5d/tslaq2_deliveries_slated_at_395k_vehicles_11_yoy/,stocks
NIKE Removed From Multiple Russell Growth And Defensive Indexes,"https://simplywall.st/stocks/us/consumer-durables/nyse-nke/nike/news/nike-nysenke-removed-from-multiple-russell-growth-and-defens

What does this mean for $NKE? Is it still worth long term investment given recent positive sentiment? Despite year over year decrease in sales is it time to move on from Nike? ",1751308949.0,https://www.reddit.com/r/stocks/comments/1lofl5l/nike_removed_from_multiple_russell_growth_and/,stocks
"As a long term investor, how to strategize my exit plan (when to sell)?","I know when a company is at a bargain to buy. Problem is, I know when to buy, but I don’t know when to sell. Do I sell when I need the money or when doctor tells me I only got a month to live? 

Let me give you several examples:

I was able to buy lots of Celsius stocks at $8 basis in 2020 when I began trying their drinks, enjoyed it and began seeing Celsius drinks sold everywhere at grocery markets and convenience stores. I felt confident. Celsius rose all the way to $95, the stock split and dropped all the way back to $25. Obviously, I did not sell any.

Same thing applies to FSLY, SQ, SE when I did not sell at the peak and watched them drop all the way back to my entry price then I panic sold and only secured a very little gain.

SMCI - I also panic sold at $23.81 for small gain and obviously, watching the price going back up is lots of pain. 

I was able to buy lots of crowdstrike last year in July when the outage caused chaos within airport and various companies. I also scooped some UNH as well due to recent (to me, it’s overreaction) free fall. 

I bought lots of ASTS at $11 and sold at $30 to get my entry money back. Then it went all the way to $46. 

Lots of people say, if a stock gives you 25% to 50%, it makes sense for you to sell all, take the profit and run. It’s not true at all. If you sold NVDA, TSLA, AMD and PLTR at 30% gain, you probably cried yourself to sleep every night. Some of the companies do have ten-fold potential if you decide to hold long. And selling them also subject yourself to short term capital gain tax. 

Also, PLTR PE ratio skyrockets. I understand military contract and AI reliance are legit, but there’s no guarantee for price to hold. When is a good time to sell? Which companies have bright future to hold strong despite free fall? Nobody has a crystal ball I understand but does reading business financial statement and learning their fundamental/ business model/ ecological system gives you a clue? 

Market is at ATH carried by major techs due to AI replacing humans leading to boost in company’s profit margin and future earning potential. But correction will eventually come. 

I need investing veterans to give me some guidances here? Appreciate it!! 

Warren Buffett once said “selling fine businesses on scary news is usually a bad decision” ",1751341699.0,https://www.reddit.com/r/stocks/comments/1lorvlt/as_a_long_term_investor_how_to_strategize_my_exit/,stocks
