title,text,created_utc,url,subreddit
"Large AI Hyperscallers Are Looking to Purchase Bitcoin Mining Data Centers for Fast Expansion, such as Riot Platforms Inc. (RIOT) CleanSpark Inc. (CLSK)","Large hyperscalers, particularly those focused on artificial intelligence (AI) and high-performance computing (HPC), are increasingly looking towards the Bitcoin mining sector. This interest isn't directly related to investing in Bitcoin mining itself, but rather driven by the advantages Bitcoin mining facilities offer in meeting the massive power demands of AI and HPC operations.

2 of the largest bitcoin mining facilities with the most Data Centers are Riot Platforms Inc. (RIOT) & CleanSpark Inc. (CLSK)

Riot Platforms is already undertaking a strategic shift towards becoming a hyperscale infrastructure provider which involves leveraging their existing infrastructure and expertise to build and operate large-scale data centers for various clients beyond crypto mining, primarily focusing on cloud computing and AI services. 

Here's why hyperscalers are interested in Bitcoin mining facilities:

* Power Requirements: AI and HPC applications require immense computational power and energy, far exceeding traditional data center needs. Bitcoin mining facilities already possess the infrastructure and access to large, often cheaper, power sources necessary for such intensive operations.
* Deployment Timelines: Building new high-performance computing (HPC) data centers from scratch can take years, with lengthy waits for electrical grid connections. Repurposing existing Bitcoin mining facilities can significantly reduce these timelines, allowing hyperscalers to deploy AI services more efficiently.
* Existing Infrastructure and Expertise: Bitcoin miners have experience in building and managing large-scale data centers, including electrical, mechanical, facilities, and security teams. This expertise can streamline the transition for hyperscalers looking to scale quickly.
* Attractive Power Contracts: Bitcoin mining companies often have attractive power contracts, which can be appealing to hyperscalers looking to secure their energy needs efficiently. ",1751309224.0,https://www.reddit.com/r/investing/comments/1lofpfo/large_ai_hyperscallers_are_looking_to_purchase/,investing
Looking for Social/Sentiment Data...,"Hey guys,

I'm convinced that valuation has four parameters that play an important role. Applied to stocks, these are:

* Potential Earnings
* Growth
* Risk
* Human Psychology (Sentiment/Social Trends)

I'm currently focused on the last one and I'm trying to establish the sentiment for single tickers, not the overall market. Do you have any recommendations on how to do it? Is Stocktwits reliable? Any other options?",1751290334.0,https://www.reddit.com/r/investing/comments/1lo7m8m/looking_for_socialsentiment_data/,investing
I reverse-engineered Russell 3k index rebalancing using ChatGPT and nailed 80% of additions - here’s how.,"Index rebalancing is a popular trade among event-driven investors.

This might sound outrageous, but I used ChatGPT o3 and a collection of Russell construction and reconstitution papers to build a surprisingly effective index rebalancing prediction model.  On this first iteration, I have just focused on additions to the Russell 3k.

Here's a high level overview of what I did.

**1. Training the logic**

I prompted o3 with Russell 3k methodology docs, academic paper (e.g., rebalancing drift) and historical addition/deletion events going back 20 years (pre '08 crash). With a lot of  coaxing and detailed prompting, o3 was able to identify repeatable inclusion rules based on:

* market cap ranking thresholds on rank days
* float-adjusted liquidity metrics
* section diversification heuristics

**2. Candidate screening**

Used codex (chatgpt's coder) to build a scanner in python to predict the likely adds for the index.  Back-tested with python code codex developed, and it show hits for about 70-80%  of adds correctly, 3-4 weeks in advanced.

**3. Trade setup**

Enter additions about 10-20 trading days before announcement.   Exit just before or during rebalance (fade the passive spike).  Of note, there were some healthy signals in deletions, but will maybe it next time.

**4. Execution**

A lot of this is qualitative in nature because of liquidity, crowding, and potential false positives.  A lot of judgment calls here based on individual names, but I was confident in the output from the backtests.

**5. Initial results**

The index rebalanced last Friday, and I went live with some capital and results look good so far.  Haven't closed out the positions but will follow-up with final p&l.

Of note, next year index constitution will move to a semi-annual basis so hopefully double the alpha haha",1751331580.0,https://www.reddit.com/r/investing/comments/1lookga/i_reverseengineered_russell_3k_index_rebalancing/,investing
Help on VTEB - VANGUARD TAX-EXEMPT BOND,So I'm a bit cash heavy because if I move jobs in the next 6 months I will want to purchase a house in cash.  I'm thinking of moving half out of a HYSA to VTEB - VANGUARD TAX-EXEMPT BOND fund.  My understanding is that I will have to manually pull out the dividends during tax time to exclude them from taxes.  I assume I can just set the dividends to reinvest without any problems?  Anything else I need to consider?,1751253298.0,https://www.reddit.com/r/investing/comments/1lnx7kf/help_on_vteb_vanguard_taxexempt_bond/,investing
Is Innodata the Next Big Winner? DD,"INOD is an American-based AI data engineering company of approximately 1.2 billion market cap. In Q1 2025, it had generated revenue of a huge 120 percent or $58.3 million over Q1 2024. The net income was recorded as 7.8 million, a huge surge since last year during the same period was only one as compared to 7.8 million in the present year. Adjusted EBITDA increased to $12.7 million compared to its previous position of 3.8 million and the company ended the quarter with 56.6 million in cash and lack of debts. The management has projected its revenue increase on the closing year by 40%+, based on the blistering AI contract cycle.

The reason Innodata is interesting is that it is the provider of data to large tech companies that are constructing AI and machine learning models. It is projects and new enterprises-scale partnerships at the company that are powered by AI-driven projects. The management said this is the best AI pipeline that they have ever witnessed. Innodata is also operating its business in a cost-effective fashion, with operating costs of about $25 million, generating revenues of about $116 million. The interest of the institutions has been increasing and a recent earnings surprise has given the stock momentum, already 4x since its 2024 lows, with a peak earlier this year near $70.

According to the one-year chart by INOD, the company projects a sharp increase of around 15 dollars in the middle of 2024 to about 70 dollars in the middle of 2025. Despite the slight setback, the 6 12 month picture is nonetheless very positive. Nevertheless, it has dangers. The company depends on a few very large customers and any deceleration in big-tech spending on AI or the loss of a giant deal may affect the outcomes. Moreover, based on the fact that the stock was already hot, its price is already high at a trailing P/E of approximately 12 despite the surge.

  
TL;DR: INOD is a young data company that develops AI-related data services and its revenue grew by 120% last year, with increasing profitability and large partnerships in the field of technology. It is already 4x up since 2024 lows, and possibly could run further in that direction; as long as it continues to perform. Great possibility, yet not without danger.",1751247439.0,https://www.reddit.com/r/investing/comments/1lnvdaj/is_innodata_the_next_big_winner_dd/,investing
Keeping a separate portfolio from company equity,"I receive equity (living in a Schwab account) from my employer as part of my compensation package. I have been unclear on how to begin investing elsewhere, while keeping these portfolios separate - with concerns mostly around tax filing implications. I have a healthy HYSA and am maxing out company matched 401k.

Is there a recommended resource I could benefit from? Considering a financial advisor, but would prefer to run solo for now.",1751220522.0,https://www.reddit.com/r/investing/comments/1lnlbx9/keeping_a_separate_portfolio_from_company_equity/,investing
What is the general take on the Efficient-Market Hypothesis?,"Hey everyone,

I am relatively new in investing (only been buying VOO for 3 years) and I have been recently reading about various investment strategy. My simple question is: is the market efficient or not? Is it a hot debate or most people agree on a side? What do finance people (beginners to advanced) think about EMH?

Edit: I hear about fancy stuff like value / growth consistently beating the market, but then I see some Reddit meme about the market being an omniscient being, and major hedge funds not being able to beat the market. I don't claim any of this is factual, I am just lost in a sea of information. Any guidance helps.

Thank you!",1751217798.0,https://www.reddit.com/r/investing/comments/1lnk7rs/what_is_the_general_take_on_the_efficientmarket/,investing
AI-driven retail investing - surprising findings.,"My thesis is that LLMs will revolutionize the way retail invest especially in stocks.

LLMs can be used for idea generation, analysis, thesis validation/testing in social forums, pre-trade, post-trade, monitoring, and even performance attribution.

In fact, I use ChatGPT o3 model for every one of the above.

There are two fundamental issues that still prevents it from becoming mainstream:

1. It has a bad tendency to give the user praise, which often will lead the user to ask the wrong follow-up questions or send them in a bad direction.
2. It has no mechanism to 100% fact-check itself  - yes clever prompting helps - but any analysis, you have to double check as well as references.

I am fortunate to be a CFA charterholder so understand when certain arguments are just plain false.

What is extremely valuable  is that once you have  a framework in mind, you can go through the entire investment process just checking the deductive reasoning, which is quick once you get the hang of it.

It's like having a full-time IB analyst from Goldman on crack, operating at 10x normal speed and doesn't need sleep.

Is anyone else using LLMs (which one) in their process and anything you have discovered?",1751307750.0,https://www.reddit.com/r/investing/comments/1lof2cj/aidriven_retail_investing_surprising_findings/,investing
Caught on a covered calls.,"So I got caught on a covered call and I'm pretty upside down on it. Not the end of the world only 1k and am ok with losing on the trade. Just wondering how others would handle it.

1. Roll it to a close to the money strike that is a month or two out?
2. Just roll 1+ year out for a much higher strike and just buy back after time decay does its thing.

Both scenarios roll for a small/ break even on premiums.",1751289322.0,https://www.reddit.com/r/investing/comments/1lo78l2/caught_on_a_covered_calls/,investing
Target Date Fund or current line up?,"
I have a 401K with Empower through my employer. These are my current investments: 

- Vanguard Institutional 500 Index Trust (56%)
- Vanguard Institutional Extended Market Index Trust (20%)
- Vanguard Institutional Total International Stock Market Index Trust (19%)
- Vanguard Total Bond Market Index Trust (5%)

Would it be beneficial to just do a JPMCB Target Date Fund 2060 or keep what I have? ",1751193996.0,https://www.reddit.com/r/investing/comments/1lnbqyv/target_date_fund_or_current_line_up/,investing
100% High Yield in my Bond Portfolio.,"And this is why.  Total returns have been higher than all of my private credit funds.

|Ticker|AUM (USD)|YTD Return†|1-Year Return†|30-Day SEC Yield|Index|
|:-|:-|:-|:-|:-|:-|
|USHY|$23.8 B|4.57 %|10.22 %|7.20 %|ICE BofA US High Yield Constrained|
|HYG|$17.6 B|4.67 %|10.36 %|6.70 %|iBoxx USD Liquid High Yield|
|JNK|$7.9 B|4.49 %|9.83 %|6.93 %|Bloomberg High Yield Very Liquid|
|SCYB|$1.16 B|4.27 %|9.77 %|7.13 %|ICE BofA US Cash Pay High Yield Constrained|
|PHYL|$0.31 B|5.18 %|11.10 %|6.94 %\*|Actively managed (no index)|",1751225408.0,https://www.reddit.com/r/investing/comments/1lnnb3q/100_high_yield_in_my_bond_portfolio/,investing
portfolio recommendations as a 27 year barely starting,"starting now at 27 years old, 2500 to invest a month - will be maxing roth ira first then rest goes into individual brokerage. 
my thoughts are the following:
VOO
VT
QQQM (personal preference between i want more aggressive exposure to tech stocks) 
SCHD

(not really interested in international markets or bonds) 
just trying to be as well diversified and aggressive as i can be while i'm young 

buy and hold until i'm 60 years old. 
will using small portion of the individual account for options plays and hedges during times of down trends in the market ",1751258420.0,https://www.reddit.com/r/investing/comments/1lnypri/portfolio_recommendations_as_a_27_year_barely/,investing
Possible to do both in Robinhood?,"Hi, I was looking at the free $1K margin on Robinhood with gold and also just got the 4.5 APY on uninvested cash. Which lead me to the question, can you do both? Can you have your uninvested cash gaining the APY and use the $1K margin to trade?

Side question, is it possible to use the free $1K margin towards the 4.5 APY for uninvested cash? ",1751242532.0,https://www.reddit.com/r/investing/comments/1lntrib/possible_to_do_both_in_robinhood/,investing
"Daily Discussion Thread for July 01, 2025",This post contains content not supported on old Reddit. [Click here to view the full post](https://sh.reddit.com/r/wallstreetbets/comments/1loxqll),1751364147.0,https://www.reddit.com/r/wallstreetbets/comments/1loxqll/daily_discussion_thread_for_july_01_2025/,wallstreetbets
RIP HOOD,calls was not the move 😭 ,1751382833.0,https://i.redd.it/p98r0clc4aaf1.jpeg,wallstreetbets
I think I did it again,Last time I was on here people wanted the positions so here you go kids. Time to go play some cod now,1751343262.0,https://www.reddit.com/gallery/1loscsg,wallstreetbets
Never give up. $25k ->$10k -> $75k,"Almost blew up my account buying puts, switches to QQQ calls last week, now buying puts again.

Will update when I blow up my account and I'm back to $0",1751381735.0,https://www.reddit.com/gallery/1lp3rql,wallstreetbets
Nana didn’t hear no bell. INTC yolo.,,1751384217.0,https://i.redd.it/o7j26bqg8aaf1.jpeg,wallstreetbets
"$14k in a day (TSLA Puts), thank you Mr. President 🫡",,1751378844.0,https://i.redd.it/oag2limhs9af1.jpeg,wallstreetbets
What companies will benefit from the big beautiful bill? What is everyone holding?,"The ""One Big Beautiful Bill,"" also known as H.R.1, is designed to benefit a variety of companies and sectors through tax cuts, spending reforms, and regulatory changes. Specifically, it aims to benefit energy companies by potentially easing regulations on fossil fuel projects and delaying methane pollution fees, defense contractors due to increased spending on defense, and small businesses through permanent and expanded tax deductions. Additionally, it seeks to incentivize American manufacturing and create new jobs by reducing taxes and restoring investment incentives. 

Question is has anyone read it? If so what are your thoughts? Position - Calls on everything",1751379819.0,https://www.reddit.com/r/wallstreetbets/comments/1lp2ztd/what_companies_will_benefit_from_the_big/,wallstreetbets
I love reddit.,Dw already sold.,1751384177.0,https://i.redd.it/267j28ac8aaf1.jpeg,wallstreetbets
5k in 1 Minute | Tks Elon 🤙🏾,Crazy that it profited right at 5k on the dot ^-^,1751377620.0,https://i.redd.it/l6k7gsjuo9af1.jpeg,wallstreetbets
I converted the entirety of my Roth IRA to HOOD LEAPS a couple weeks ago,,1751331592.0,https://www.reddit.com/gallery/1lookl5,wallstreetbets
med the reversal perfectly $TSLA 305P +11k into the close,,1751392387.0,https://i.redd.it/47leptwqwaaf1.png,wallstreetbets
$HOOD Gains ($116k),I bought some at IPO and have been adding heavily when it was down. I added some when they were rebalancing SP500.,1751336064.0,https://i.redd.it/pbzfys5a96af1.jpeg,wallstreetbets
$176k KSS YOLO update.  Getting myself some Kohl's Cash,,1751383662.0,https://i.redd.it/9a7rmv0j6aaf1.png,wallstreetbets
HOOD buy and hold since last April,Bought 30x $20 HOOD calls in 2023. Sold them in 2024 and put all the proceeds towards shares. Been holding ever since. HOOD is a super long term hold IMO. ,1751330222.0,https://i.redd.it/78hg4ovwr5af1.png,wallstreetbets
$BULL,"We back back boys!!! HODL

",1751322125.0,https://i.redd.it/q4a0ny2u35af1.jpeg,wallstreetbets
CRWV 9K  My Contrarian Move,,1751384315.0,https://i.redd.it/cjc1vfmg7aaf1.jpeg,wallstreetbets
"TSLA fell, and I rose. That's balance",,1751377918.0,https://i.redd.it/2yxk97ffp9af1.jpeg,wallstreetbets
$BBAI YOLO CALLS,"I dug into the rabbit hole of Palantir and Alex Karp last night and came to the conclusion that they essentially are fast forwarding our timeline to that of the “Minority Report”. Eventually Palantir’s software will be able to predict crime before it even happens and with their partnership with BBAI I’m bullish. BBAI is in Airports, UAE, Defense Tech, Space Cybersecurity and more. 

I’m YOLOing 20+k into 388 contracts.
",1751380191.0,https://www.reddit.com/gallery/1lp357a,wallstreetbets
HOOD just keeps going up😮‍💨🚀🦅,,1751340939.0,https://www.reddit.com/gallery/1lorna2,wallstreetbets
$SOFI Gains (+$152k),I bought SoFi at IPO and have been adding since.,1751339069.0,https://i.redd.it/3af81yt7i6af1.jpeg,wallstreetbets
[BREAKING] Apple Weighs Using Anthropic or OpenAI to Power Siri in Major Reversal,"[Siri AI ](https://www.bloomberg.com/news/articles/2025-06-30/apple-weighs-replacing-siri-s-ai-llms-with-anthropic-claude-or-openai-chatgpt)Announcement  
Get on the money train now.  ",1751310015.0,https://www.reddit.com/r/wallstreetbets/comments/1log1s8/breaking_apple_weighs_using_anthropic_or_openai/,wallstreetbets
Can someone explain the Carvana nonsense to me?,"It's just not an impressive idea or company. I understand year over year growth is ripping but why such premium valuation? P/E of 118 and fwd p/e at 72. Very low volume and just seems to pump. How is this worth 72 billion? I know it's propped up by institutions, but I'd agree with Hindenburg research that there's a lot of smoke and mirrors. So much corruption and manipulation of numbers, from the outside looking in it's an obvious grift. Will this quarter's earnings be the one where it drops 25% or the next one? Who knows. But I know they aren't special, it's making Tesla look like a buy in comparison LOL 

And ya I have some puts for mid August, doubled down today. Eventually reality will hit (same with Tesla) and the greedy bulls will get what's coming 🙂

",1751321340.0,https://www.reddit.com/r/wallstreetbets/comments/1lokt8b/can_someone_explain_the_carvana_nonsense_to_me/,wallstreetbets
All in MSTR calls. 100% of my account. Zero? Or a million?,,1751303549.0,https://i.redd.it/g0iw6yilk3af1.jpeg,wallstreetbets
IREN Play Gain,Jacked to the tits!! Letting 500 shares ride,1751381778.0,https://www.reddit.com/gallery/1lp3sd2,wallstreetbets
HOOD RICH?,,1751306425.0,https://i.redd.it/blq7ugf5t3af1.jpeg,wallstreetbets
HOOD/SPY Gains,I was up like 9k with HOOD. Greed got the best of me. I thought it would hit 💯. Ended up cashing with 4.4k profits. I hope you all made your money on today’s market.,1751384047.0,https://i.redd.it/97ytn9cy7aaf1.jpeg,wallstreetbets
Thank you HOOD,"Busted through 100k today. HOOD is such a monster — revolutionizing the game. First gain post, screenshot means sell apparently. I think I’m good 🫡 RDDT is next ",1751301247.0,https://www.reddit.com/gallery/1loc6pj,wallstreetbets
135 shares of TSLA,Think it rallies to $400 then pulls back again. YOLO,1751378926.0,https://i.redd.it/3ug3dgdqs9af1.jpeg,wallstreetbets
my entire port on hood,i like the stock i guess,1751332907.0,https://www.reddit.com/gallery/1lop0tu,wallstreetbets
Still all in on FUBO,This stock is going to $10+ just watch. Once HULU merger is complete. ,1751383637.0,https://i.redd.it/i8bvquqq6aaf1.jpeg,wallstreetbets
"Robinhood to offer tokenized shares of OpenAI, SpaceX to EU users in growth push",,1751303567.0,https://www.theblock.co/post/360354/robinhood-to-offer-tokenized-shares-of-openai-spacex-to-eu-users-in-growth-push,wallstreetbets
"CUT YOUR GAINS, LET YOUR LOSSES RUN","Down over 30kUSD. Putting all my money in triple leverage YINN Chinese options 
I keep thinking options are a good idea and then I lose all my money... DOWN ON MY PUTS AND CALLS HOW IS THAT POSSIBLE?

Any suggestions on how to break even? ",1751292207.0,https://i.redd.it/8emhgqevm2af1.jpeg,wallstreetbets
Naming my first born Vlad,$HOOD tokenizing the world. $150 soon.,1751335005.0,https://i.redd.it/o2e66un466af1.jpeg,wallstreetbets
Lost 150k this month so I’m YOLOing the rest,,1751303837.0,https://i.redd.it/cuaunzegl3af1.jpeg,wallstreetbets
"What Are Your Moves Tomorrow, July 01, 2025",,1751313454.0,https://www.reddit.com/r/wallstreetbets/comments/1lohict/what_are_your_moves_tomorrow_july_01_2025/,wallstreetbets
"Nice 0DTE SPY scalp for almost $6k, with scaling and exit strategy explained","https://preview.redd.it/e8d52c8l3aaf1.png?width=828&format=png&auto=webp&s=51db893fb194340fc338c6b79635f0286b15fb69

I keep getting asked about some of the things I am looking for and comments about my ""wild"" scaling in my other posts. So I did this one more by the book to show some of you what I am looking for. As you can see with my purchases, after I decide on a reversal direction @ around 10:30, I go in with 50 contracts. Those almost immediately spiked and I could have been out with 20+% gain on my first purchase, but that would have only been like 6-700 so I was willing to press it. It then fell hard.

I knew the previous V bottom was coming up at 615ish so I averaged down when I was around 20% down. I purchased 2x the amount of already held contracts (50 x 2 = 100) to give myself 150. These fluctuated, but trended down so I again averaged down the same way, 20% down 2x already held. That got me to 450 contracts @ around 0.42 each down just a bit right next to the previous V bottom. This is also my cut off. I don't typically like to do more than 20k on 1 trade. And I am willing to loose up to 30% and take as little as 10% on a win. But when sized up, 10% is still $2k.

As for my exit, on the bounce I knew I would only play this for a short time. This is because the moves up have been rippers today and there is resistance at 617.30ish. So my out was whatever I had when it hit around 617.20ish. That ended up being this win for around 28% or so.

Also, I know I will save money on doing SPX. I just haven't made the transition yet.

",1751383549.0,https://www.reddit.com/r/wallstreetbets/comments/1lp4kb5/nice_0dte_spy_scalp_for_almost_6k_with_scaling/,wallstreetbets
$840 > $6144 in less than 2 hours,AAPL just felt right and moments later... Kept 5 just to see what happens this week ,1751313168.0,https://www.reddit.com/gallery/1lohe3w,wallstreetbets
Goog buy buy buy,"Bought 40 calls of GOOG, thanks Jim for the inspiration https://finance.yahoo.com/news/jim-cramer-alphabet-not-think-160116222.html Jim Cramer on Alphabet: “I Do Not Think It’s the Leader”",1751394212.0,https://i.redd.it/yjvleun62baf1.jpeg,wallstreetbets
1500% Robinhood Gain,"First post on this subreddit for me. Ive been investing for a little over a year, and this is the biggest percent gain I've had so far. Of course, out of all the positions I had for the correction after tariffs were postponed, this was the one I had the least amount of money in. But hey, a win is a win.",1751314917.0,https://i.redd.it/1ztdjojei4af1.jpeg,wallstreetbets
-$8500 Coreweave Loss. We Will Get Em Next Time Boys!,,1751318123.0,https://i.redd.it/c95hvylxr4af1.jpeg,wallstreetbets
$HOOD,,1751309312.0,https://i.redd.it/xkpy9zeq14af1.jpeg,wallstreetbets
"GATHER, HOOD FAITHFUL",My pp not so big like many degens here. But my pp faithful for so long time. $13 average. ,1751313342.0,https://i.redd.it/8nij84xpd4af1.jpeg,wallstreetbets
$BBAI’s a 🏃‍♂️💨,"Not claiming to be a trading expert, but this BBAI $5 call expiring July 25th has been on fire the past two weeks. Volume’s been heavy daily, and the momentum just keeps rolling—today it’s up 110%, with a +$10.5K gain and the stock at $6.93. Open interest is strong, IV is rocking at 145%, and delta’s sitting at 0.92.

This is my trade, my decision—not financial advice. I’m just putting it out there in case someone’s looking for ideas. I don’t recommend copying me, but I truly believe that long-term investing in strong plays like this can pay off big time.

Check the chart, read the news—see the momentum for yourself.",1751334666.0,https://i.redd.it/mob532j456af1.jpeg,wallstreetbets
Finally closed the position 89% gain!!!,,1751314211.0,https://i.redd.it/4w1um5yag4af1.jpeg,wallstreetbets
Full Port ROTH IRA w/ $AAPL,"With AI’s sharp mind and Siri’s wise voice,

Innovation sparks, making markets rejoice.

HEY SIRI, CAN U PLS BRING APPLE TO ALL TIME HIGH.",1751334117.0,https://www.reddit.com/gallery/1lopfgk,wallstreetbets
$2750 to $15060 on $HOOD long dated calls,"Been holding these bad boys since March. There was a point where I was down over 50% but we did the degen thing and doubled down.  Sold this morning right before Robinhood EU event (regrettably) but hey, 12.3k profit!!! ",1751304772.0,https://www.reddit.com/gallery/1lodqzb,wallstreetbets
Full port with Blackberry,,1751310045.0,https://i.redd.it/1rl3mqyw34af1.jpeg,wallstreetbets
