timestamp,source,headline,text,url,company
1748768419.0,reddit,Rate My Portfolio - r/Stocks Quarterly Thread June 2025,"Please use this thread to discuss your portfolio, learn of other stock tickers & portfolios like [Warren Buffet's](https://buffett.online/en/portfolio/), and help out users by giving constructive criticism.

Why quarterly?  Public companies report earnings quarterly; many investors take this as an opportunity to rebalance their portfolios.  We highly recommend you do some reading:  Check out our wiki's list of [relevant posts & book recommendations.](https://www.reddit.com/r/stocks/wiki/index/#wiki_relevant_posts.2C_books.2C_wiki_recommendations)

You can find stocks on your own by using a scanner like your broker's or [Finviz.](https://finviz.com/screener.ashx)  To help further, here's a list of [relevant websites.](https://www.reddit.com/r/stocks/wiki/index/#wiki_relevant_websites.2Fapps)

If you don't have a broker yet, see our [list of brokers](https://www.reddit.com/r/stocks/wiki/index/#wiki_brokers_for_investing) or search old posts.  If you haven't started investing or trading yet, then setup your [paper trading to learn basics like market orders vs limit orders.](https://www.reddit.com/r/stocks/wiki/index/#wiki_is_there_a_way_to_practice.3F)

Be aware of [Business Cycle Investing](https://eresearch.fidelity.com/eresearch/markets_sectors/sectors/si_business_cycle.jhtml?tab=sibusiness) which Fidelity issues updates to the state of global business cycles every 1 to 3 months (note: Fidelity changes their links often, so search for it since their take on it is enlightening).  [Investopedia's take on the Business Cycle](https://www.investopedia.com/articles/investing/061316/business-cycle-investing-ratios-use-each-cycle.asp).

If you need help with a falling stock price, check out Investopedia's [The Art of Selling A Losing Position](https://www.investopedia.com/articles/02/022002.asp) and their [list of biases.](https://www.investopedia.com/articles/stocks/08/capital-losses.asp)

Here's a list of all the [previous portfolio stickies.](https://www.reddit.com/r/stocks/search?q=author%3Aautomoderator+title%3A%22Rate+My+Portfolio%22&restrict_sr=on&sort=new&t=all)",https://www.reddit.com/r/stocks/comments/1l0kgkw/rate_my_portfolio_rstocks_quarterly_thread_june/,
1754315444.0,reddit,"r/Stocks Daily Discussion Monday - Aug 04, 2025","These daily discussions run from Monday to Friday including during our themed posts.



Some helpful links:



\* \[Finviz\](https://finviz.com/quote.ashx?t=spy) for charts, fundamentals, and aggregated news on individual stocks

\* \[Bloomberg market news\](https://www.bloomberg.com/markets)

\* StreetInsider news:

  \* \[Market Check\](https://www.streetinsider.com/Market+Check) - Possibly why the market is doing what it's doing including sudden spikes/dips

  \* \[Reuters aggregated\](https://www.streetinsider.com/Reuters) - Global news



If you have a basic question, for example ""what is EPS,"" then google ""investopedia EPS"" and click the investopedia article on it; do this for everything until you have a more in depth question or just want to share what you learned.



Please discuss your portfolios in the \[Rate My Portfolio sticky.\](https://www.reddit.com/r/stocks/search?q=author%3Aautomoderator+title%3A%22Rate+My+Portfolio%22&restrict\_sr=on&sort=new&t=all).



See our past \[daily discussions here.\](https://www.reddit.com/r/stocks/search?q=author%3Aautomoderator+%22r%2Fstocks+daily+discussion%22&restrict\_sr=on&sort=new&t=all)  Also links for:  \[Technicals\](https://www.reddit.com/r/stocks/search?q=author%3Aautomoderator+title%3Atechnicals&restrict\_sr=on&include\_over\_18=on&sort=new&t=all) Tuesday, \[Options Trading\](https://www.reddit.com/r/stocks/search?q=author%3Aautomoderator+title%3Aoptions&restrict\_sr=on&include\_over\_18=on&sort=new&t=all) Thursday, and \[Fundamentals\](https://www.reddit.com/r/stocks/search?q=author%3Aautomoderator+title%3Afundamentals&restrict\_sr=on&include\_over\_18=on&sort=new&t=all) Friday.",https://www.reddit.com/r/stocks/comments/1mhe080/rstocks_daily_discussion_monday_aug_04_2025/,
1754338264.0,reddit,"Palantir tops $1 billion in revenue for the first time, boosts guidance","Palantir topped Wall Street’s estimates Monday, surpassing $1 billion in quarterly revenue for the first time, and hiking its full-year guidance.

Here’s how the company did versus LSEG estimates:

Earnings per share: 16 cents adj. vs. 14 cents expected

Revenue: $1.00 billion vs. $940 million expected

The artificial intelligence software provider’s revenues grew 48% during the period. Analysts hadn’t expected the $1 billion revenue benchmark from the Denver-based company until the fourth quarter of this year.

“The growth rate of our business has accelerated radically, after years of investment on our part and derision by some,” wrote CEO Alex Karp in a letter to shareholders. “The skeptics are admittedly fewer now, having been defanged and bent into a kind of submission.”

The software analytics company also boosted its full-year outlook guidance. For the full year, Palantir now expects revenues to range between $4.142 billion and $4.150 billion, up from prior guidance of $3.89 billion to $3.90 billion.

Source: https://www.cnbc.com/2025/08/04/palantir-pltr-q2-earnings-2025.html",https://www.reddit.com/r/stocks/comments/1mhob24/palantir_tops_1_billion_in_revenue_for_the_first/,
1754325237.0,reddit,"The PermaBulls have been right all along, and perhaps my brain is the smoothest of them all.","I have been firmly in the bear camp for 1/2 decade.

My post history will outline many of the reasons why, but I think I've finally had to come to accept that this market will never see the likes of a massive, dot com, global financial crisis style correction ever again.

A global pandemic that shut the world down couldn't do it (SPY found a new high within 6 months).

Global conflict cannot do it -- the world is as to nuclear war as it's been since the collapse of the USSR.

Ridiculous valuations cannot do it -- The SPY is trading at a P/E that was only higher during dot com, GFC, and for one quarter after COVID hit -- at any point in the last 125+ years.

Bank failures cannot do it -- The failures of signature bank, silicon valley bank, and first republic banks, by assets under management, were larger than all the bank failures combined of the +/- 450 banks that failed in 08.

Rising delinquency rates in auto loans and credit card debt, paired with the highest balances on consumer debt in history have no effect.

A failing commercial real estate sector has no impact.

High interest rates, paired with an unaffordability crisis in the housing sector, means that a majority of Americans can no longer afford to buy a home... irrelevant.

Global trade wars that tank the market 20% only have the ability to hold that price action for 4 months before the market finds new highs.

No my friends -- I think the time has finally come for me to eat my words. To throw caution out the window. To say f\*ck the news, TA, historical precedence, or any individual smell test.

There is only one thing you need to know to get rich in the new age of markets.

Stocks. Only. Go. Up.",https://www.reddit.com/r/stocks/comments/1mhic22/the_permabulls_have_been_right_all_along_and/,
1754310469.0,reddit,Tesla shareholders are rejoicing as it is more likely to pay Elon $29 Billion instead of $50 Billion,"[Reuters/Yahoo](https://finance.yahoo.com/news/tesla-approves-96-million-share-102426782.html)

Tesla has granted 96 million new shares worth about $29 billion to CEO Elon Musk.

""The interim award shares vest only if Musk remains in a key executive role through 2027. They also come with a five-year holding period except to cover tax payments or the purchase price.""

""It added that if the Delaware courts fully reinstate the 2018 CEO Performance Award, the new interim grant will either be forfeited or offset and there will be no ""double dip,""""

The original package valued at over $50 billion was voided by a Delaware court in 2024.  Musk appealed, and the Tesla board subsequently formed a special committee to consider some compensation.

""The new award is designed to gradually boost Musk's voting power, something he and shareholders have consistently said was key to keeping him focused on Tesla's mission.""",https://www.reddit.com/r/stocks/comments/1mhc1tt/tesla_shareholders_are_rejoicing_as_it_is_more/,
1754343863.0,reddit,Hims & Hers stock falls 10% on revenue miss,"Shares of Hims & Hers Health fell 9% in extended trading on Monday after the telehealth company reported second-quarter results that missed Wall Street’s expectations for revenue.

Here’s how the company did based on average analysts’ estimates compiled by LSEG:

Earnings per share: 17 cents adjusted vs. 15 cents

Revenue: $544.8 million vs. $552 million

Revenue at Hims & Hers increased 73% in the second quarter from $315.6 million during the same period last year, according to a release. Hims & Hers reported a net income of $42.5 million, or 17 cents per share, compared to $13.3 million, or 6 cents per share, during the same period a year earlier.

For its third quarter, Hims & Hers said it expected to report revenue between $570 million to $590 million, while analysts were expecting $583 million. The company said its adjusted EBITDA for the quarter will be between the range of $60 million to $70 million. Analysts polled by StreetAccount were expecting $77.1 million.

Source: https://www.cnbc.com/2025/08/04/hims-hers-hims-q2-earnings-2025.html",https://www.reddit.com/r/stocks/comments/1mhqryi/hims_hers_stock_falls_10_on_revenue_miss/,
1754326345.0,reddit,Screenshots I took of comments from investing subreddits April 2025. Market is up ~27% since,"https://imgur.com/a/j3vlh6q

Ironically, commenters should have listened to the quote they were attempting to mock - be greedy when others are fearful. 

When the tariff fears were at their peak in April and market was down 16% YTD, I couldn’t believe the comments I was seeing all over reddit. This is just a small sampling of pure panic comments that had a lot of upvotes. 

Of course, hindsight is 20/20 and I wouldn’t be posting this if we never recovered. And I’m not saying we are out of the woods yet or shouldn’t expect another correction. However, something has to be said when the people who champion DCA and time in the market > timing the market completely crumble during a correction. 

Two takeaways:
- You must have high conviction in your investing strategy. I am a permanent, long term BULL and will always buy and hold. I will only get out of the market if I need emergency money or society as we know it is collapsing (in which case money would be useless anyway).
- The Reddit (and internet at large) hive mind is real. The sentiment on these subs could not have been lower in April yet here we are, doing alright in my opinion.

What do you guys think - anyone guilty of panicking and abandoning their strategy back in April?

",https://www.reddit.com/r/stocks/comments/1mhitto/screenshots_i_took_of_comments_from_investing/,
1754358327.0,reddit,"Senate will make sure Fed remains independent(bloomberg TV), what do you think?","I have been scratching my head as to why the bond/stock market is so resilient given that Federal govt wants to monetize the debt without any regard to value of USD going down(this will lead to loss of reserve currency status).

I was wondering if the elites have lost all influence, I mean, there may be around 3000 people with networth of more than 500 million, they have the maximum to lose if things break down. IMO, they will try to make sure that the current economic/geopolitical system is not dismantled without an idea/plan about the future economic/geopolitical order. It can lead to chaos or hyperinflation or stagflation.

I heard on bloomberg this morning that senate is not going to let the destruction of Fed independence happen. This makes total sense to me since most of them have relationship with  industry leaders and they themselves have a lot to lose if we get economic crash like 2008. Supposedly, senate will make sure a qualified person will be the new Fed governor. I am guessing same applies to next Fed chair.

What are your thoughts on this?

BTW, I am not saying that the rich can get away with anything. I am just implying that 99% of people do not have such influence after election is over. IMO, only the top 0.2% have relationship with elected officials.",https://www.reddit.com/r/stocks/comments/1mhwbvc/senate_will_make_sure_fed_remains/,
1754360306.0,reddit,"Palantir topped Wall Street’s estimates Monday, surpassing $1 billion in quarterly revenue for the first time.","Shares rallied 3% after the bell.

Here’s how the company did versus LSEG estimates:

Earnings per share: 16 cents adj. vs. 14 cents expected

Revenue: $1.00 billion vs. $940 million expected

The artificial intelligence software provider’s revenues grew 48% during the period. Analysts hadn’t expected the $1 billion revenue benchmark from the Denver-based company until the fourth quarter of this year.

“We’re planning to grow our revenue ... while decreasing our number of people,” CEO Alex Karp told CNBC’s Morgan Brennan in an interview. “This is a crazy, efficient revolution. The goal is to get 10x revenue and have 3,600 people. We have now 4,100.”

Potentially related companies: NVDA, AMD, OPEN, BGM, ASML, APP",https://www.reddit.com/r/stocks/comments/1mhx24i/palantir_topped_wall_streets_estimates_monday/,
1754337764.0,reddit,Good time to buy BRK.B?,"Are people buying BRK.B after the recent dip? Those in the know of how insurance stocks usually work and how tariffs are expected to affect this sector, how long of a turn around would you expect for an otherwise solid and stable company? It’s currently ~12% down over three months. 

Wondering if this is a good stock to buy with an outlook to sell in about a year. ",https://www.reddit.com/r/stocks/comments/1mho37e/good_time_to_buy_brkb/,
1754292240.0,reddit,Wow markets don’t seem like they will open Monday red,"Given last Friday’s happenings, I thought markets would immediately trade on Monday in the red starting with overnight trading. 

Afterall, the weak jobs report - tgt with downward revisions for past two months - were serious red flags for the economy’s resilience.

But seems like markets are taking that as positive - that it will reinforce rate cuts likelihood and be a leg up overall. 

Damn… markets getting mad euphoric.",https://www.reddit.com/r/stocks/comments/1mh6x10/wow_markets_dont_seem_like_they_will_open_monday/,
1754320614.0,reddit,Not Fed Cut in Sept.,"I predict no Fed cut in Sept, contrary to what the market is pricing in. This is because we still have July inflation numbers coming out next week. I expect inflation to ramp up and because the inflation numbers are further from target, compared to unemployment, I see the Fed not changing rates. This is gonna lead to a large correction in the markets because the markets haven't fully priced in tariff inflation risks.",https://www.reddit.com/r/stocks/comments/1mhg8tz/not_fed_cut_in_sept/,
1754300993.0,reddit,Tesla's July China-made EV sales fall 8.4%,"Tesla's (TSLA.O), opens new tab sales of China-made electric vehicles in July fell 8.4% from a year earlier, reversing a mild increase in June, in the face of rising competition from rivals offering lower-priced new models.
Deliveries of Tesla's China-made Model 3 and Model Y vehicles, including exports to Europe and other markets, reached 67,886 units last month, down 5.2% from June, data from the China Passenger Car Association showed on Monday.

https://www.reuters.com/business/autos-transportation/teslas-july-china-made-ev-sales-fall-84-2025-08-04/",https://www.reddit.com/r/stocks/comments/1mh94v7/teslas_july_chinamade_ev_sales_fall_84/,
1754301908.0,reddit,Since BLS Reports are about to lose relevance/credibility what other reports are you watching? ADP maybe?,"Let’s be real. If Trump wins and drops one of his people into the BLS, the jobs report is toast. Fully cooked. We’re talking “everything is fine” vibes while the economy bleeds out.

This isn’t tinfoil hat territory either. It’s already kind of happening. Look at May 2025: the BLS initially reported 139,000 jobs added. Two months later, that got revised down to 19,000. That’s not a small miss. That’s a total rewrite of the story.

Meanwhile, ADP reported 37,000 for that same month. Not perfect, but a hell of a lot closer than the BLS fantasy number. And that’s the point. ADP pulls data from actual payrolls at real companies. BLS does surveys and then layers on seasonal adjustments, revisions, and eventually, political spin.

Now imagine a loyalist takes over and starts reporting whatever number they’re told to print. Ten million jobs? Sure. Zero layoffs? Why not. Reality doesn’t matter when the data becomes a political weapon.

At this point, I’m not even watching the BLS numbers anymore. If the market still reacts to them, fine, but I’m treating them like CPI. Rigged until proven otherwise.

Here’s what I’m actually watching:
	•	ADP payroll data – based on real checks, not surveys
	•	Challenger job cuts – tells you when companies are getting nervous
	•	LinkedIn and Indeed job posting trends – real-time demand
	•	Conference Board employment index – solid composite signal
	•	Household Pulse Survey – faster, less manipulated than BLS

If we’re headed into a manipulated-data economy, I want to at least be looking at something closer to the truth. The BLS used to matter, but if the next admin turns it into a propaganda machine, it’s just another lagging indicator that lies.

Anyone else already moved on? Or are you still trading off the Friday fairy tales?",https://www.reddit.com/r/stocks/comments/1mh9dwk/since_bls_reports_are_about_to_lose/,
1754347730.0,reddit,Snap DD for Earnings,"Snap will beat earnings. 

Google and Meta have traditionally captured share and posted 10+% and 20+% growth consistently.

This often came at the expense of other players but I think the display ad market has grown quite a bit this year.

Even MSFT's advertising grew 20% plus compare to ~10% for the same quarter last year. Roku and TTD posted ~20% gain as well. 

Unless the folks at SNAP are completely lacking in their GTM strategy, I think there will be a surprise when it comes to advertising earnings. 

Position: ~$600 bet on Aug 8, 10.5 calls; meagre, I know but disclosure is important ",https://www.reddit.com/r/stocks/comments/1mhsdl6/snap_dd_for_earnings/,
1754309897.0,reddit,"Basically for ACHR to run, everything has to line up","As someone who’s been holding ACHR through the ups and downs, this week’s 14% drop didn’t shake me. Sentiment across eVTOLs is clearly cooling off after the hype wave earlier this year & Archer’s still pre revenue, which means every move is amplified. No news from the company, just light volume & some options hedging

JPMorgan raised their price target from $9 to $10 but still kept a Neutral rating. They flagged cash burn and delays in revenue as key risks (nothing new) & called the recent market behavior *irrational exuberance.* Not wrong, but a PT bump is still a bullish tell

They also don’t expect Trump’s executive order *(which explicitly supports advanced air mobility)* to impact earnings soon but let’s be real, that kind of policy shift helps the long term narrative.

Technicals are a mixed bag right now. MACD shows a buy, but 20 day and 50 day EMAs are still above the current price, so short term traders are treating this like a downtrend. Doesn’t change my thesis.

The stock is still trading with speculative energy, but that’s how early-stage bets work. Analysts are still leaning bullish with a “Moderate Buy” consensus & a $11.92 PT *(almost 24% upside from here).*

For ACHR to rerate higher, they’ll need to deliver clean earnings, show progress on certification milestones, and eventually break into revenue territory. Until then, volatility is just part of the package.

If you’re in from $12+, sure, that hurts. But sub $10 is a zone I’ll keep nibbling. Not saying it moons tomorrow, but I’d rather build a position now than chase it later on a surprise catalyst",https://www.reddit.com/r/stocks/comments/1mhbufy/basically_for_achr_to_run_everything_has_to_line/,
1754239420.0,reddit,Will we retroactively be declared to have already have been in a recession at this time?,"The National Bureau of Economic Research (NBER) is the official arbiter of U.S. recessions. They retrospectively declared that the recession, which would become known as the ""Great Recession"", began in December 2007.

Here are the BLS Non-Farm Payrolls numbers for October, November, and December of 2007, based on the final revised figures:

October 2007: +103,000 jobs

November 2007: +124,000 jobs

December 2007: +18,000 jobs

What were are last 3 months of job numbers from the BLS Non-Farm payrolls?

May 2025: +19,000 Jobs

June 2025: +14,000 jobs

July 2025: +73,000 jobs (Initial unrevised figure)

Yes, the headline U3 unemployment rate hit a cycle high at 4.25% but in absolute terms that’s still a very low unemployment rate. However, we must take into account that Bureau of Labor Statistics Non-Farm payroll job numbers lead the U3 unemployment rate. 

Mainly because the U3 unemployment rate often stays lower for longer because even as layoffs increase, until unemployed individuals actually remain out of work long enough, they won’t affect the headline number. 

Whereas with BLS Non-Farm payrolls, businesses will reduce hiring or stop adding jobs before they begin large-scale layoffs that would show up in U-3.",https://www.reddit.com/r/stocks/comments/1mgnxs7/will_we_retroactively_be_declared_to_have_already/,
1754300795.0,reddit,Analyst bullish on Palantir stock before earnings,"Wedbush reiterated an outperform rating and a price target of $160 for Palantir stock ahead of its earnings, according to a recent research note.

Analysts led by Daniel Ives said the recent deal with the U.S. Army represents an additional tailwind, which places Palantir in the sweet spot to benefit from ""a tidal wave of federal spending on AI.""

""We continue to believe that Palantir’s unique AI software approach will be a positive growth catalyst as governments look to further increase efficiency with more software/lower headcount,"" Ives wrote.

Besides, I also have a personal watchlist, any opinion is welcomed. 

NVDA, AMD, OPEN, BGM, ASML, APP",https://www.reddit.com/r/stocks/comments/1mh92z4/analyst_bullish_on_palantir_stock_before_earnings/,
1754357772.0,reddit,Should I keep my OXY and ELI???,"My portfolio is pretty simple, its 75% VOO and the rest is individual stocks and crypto (BTC and ETH).

My individuals are all doing great apart from OXY and ELI. They have been constantly in the red.

Do you think its worth hanging on to these guys or cut my losses with them.

I'm a long term investor btw so not looking to get rich quick.

Thanks",https://www.reddit.com/r/stocks/comments/1mhw4jx/should_i_keep_my_oxy_and_eli/,
1754251799.0,reddit,Is Figma today’s Beyond Meat IPO?,"In 2019 Beyond Meat was oversubscribed, same as Figma today. Beyond Meat saw about 160% surge on day 1, Figma about 250%. Beyond Meat meant to disrupt meat with sustainability and health, Figma design with AI. Both highly valued, venture backed, private unicorns.

Is this just another FOMO?",https://www.reddit.com/r/stocks/comments/1mgt54d/is_figma_todays_beyond_meat_ipo/,
1754246001.0,reddit,Best stocks to buy after the tariffs,I’m hoping to buy the dip for companies that will drop after trumps tariff announcement. I see this as a similar opportunity to April 7. What are the best/easiest stocks to buy right now (Monday morning) so I can sit back and watch them grow over the next couple of months. ,https://www.reddit.com/r/stocks/comments/1mgqq3y/best_stocks_to_buy_after_the_tariffs/,
1754221111.0,reddit,Waller and Bowman say waiting to cut rates threatens economy.  These dissents are the first time two governors have done so since 1993.,"[Source CNBC](https://www.cnbc.com/2025/08/01/fed-governors-bowman-waller-explain-their-dissents-say-waiting-to-cut-rates-threatens-economy.html)

[CME FedWatch](https://www.cmegroup.com/markets/interest-rates/cme-fedwatch-tool.html)

Both Governors, Christopher Waller and Michelle Bowman, sought a 25-basis-point reduction, as maintaining the status quo poses risks to the economy. Noted tariffs have only a temporary impact on inflation. These dissents are the first time two governors have done so since 1993.

Bowman (who also serves as the Fed’s vice chair for bank supervision) stated, “I see the risk that a delay in taking action could result in a deterioration in the labor market and a further slowing in economic growth.”

Their statements, as well as Powell's statement, came before the huge correction in the job data. The Labor Department report on Friday showed that nonfarm payrolls rose by just 73,000 in July, below expectations, while the June and May counts were revised lower by a combined 258,000, which showed virtually no growth for both months.

Some suggested that the Fed might have cut rates if the July jobs report had come before this past Wednesday's meeting. Powell's tone would also probably have been much more dovish if the job data corrections were known beforehand.

The probability of a September 25-basis-point Fed interest rate cut has jumped from 61.9% to 80.3% in 1 week.",https://www.reddit.com/r/stocks/comments/1mgh3ky/waller_and_bowman_say_waiting_to_cut_rates/,
