timestamp,source,headline,text,url,company
1754297394.0,reddit,Need advice with index funds,Hi everyone I want to start with ETFs and thought about the S&P 500. Now I'm based in Europe and most information I find is always for US based individuals. It be happy to get some guidance in my endeavour and learn from your experience. Thank you!,https://www.reddit.com/r/stocks/comments/1mh87gv/need_advice_with_index_funds/,
1754361501.0,reddit,Stock Market Growth,"Do we think that the Stock Market will truly continue to grow for the next 40+ years? Are we true to expect 7% rates annually (on average) from the S&P 500? I truly just wonder the true likelihood that it will simply continue to grow. Almost everything stops growing after a while, what makes we sure that the market will continue to go up? ",https://www.reddit.com/r/stocks/comments/1mhxh96/stock_market_growth/,
1754356083.0,reddit,APLD cool down,"Hi all I’m new here. I’m trying to see some other perspectives. 

As of today APLD is $13.96. It’s been killing it in the market.  However the RSI is 64 slight overbought. 

My question is does anyone else think tomorrow will be a dip? If so I’ll be buying more. I’m just trying to see if anyone else has a similar view.",https://www.reddit.com/r/stocks/comments/1mhvixz/apld_cool_down/,
1754282858.0,reddit,$NVT still good to get in?,"Was eyeing nVent electric this past month as I'm understanding the AI value chain/ecosystem and their earnings popped like hell, pushing their stock price 15% up. From what I saw, their Financials were good and it WAS trading at 18x PE. But, I know nvidia's new chils require liquid cooling so the more the merrier, still?",https://www.reddit.com/r/stocks/comments/1mh4ccg/nvt_still_good_to_get_in/,
1754164011.0,reddit,"After recent jobs data, Moody's model raises recession probability to 49%","Moody's forecast model for recession, which has had zero false positives, now predicts 49% probability of recession.

>Every time that particular model gets over 50 (50%) we've had a recession. And we've never had a false positive. Never has it risen above 50, and we've not gotten a recession. ([source](https://www.moodys.com/web/en/us/about/insights/podcasts/moodys-talks-inside-economics/on-an-economic-tight-rope.html))

Their chief economist, Mark Zandi, subjectively states, ""In my heart of hearts, I think we're going into a recession.""

Notably, they did not lower their recession odds much in the past few months, even during the recent exuberant market rally. (Obviously, the stock market is not equivalent to the economy, but there is usually a strong relationship between the two.)",https://www.reddit.com/r/stocks/comments/1mfzgx3/after_recent_jobs_data_moodys_model_raises/,
1754328065.0,reddit,FIG crash (should I pull or stay),"I’m new to investing and for some reason decided it would be good to go in with most on my money when FIG was at it’s near peak 127 and since then only crashed to 95, causing me to lost a big big chunk of my account, so I’m wondering if I should pull out and take the loss or should I stay incase it goes back up?",https://www.reddit.com/r/stocks/comments/1mhjmp7/fig_crash_should_i_pull_or_stay/,
1754267625.0,reddit,"MOAT, VOO or picking on my own","So after 2.5 years of trying different methods (fundamental analysis, intrinsic value, technical analysis), I give up trying because I can’t beat the market. After reading “The Buffet Way”, I decided to bet on wide moat, exemplary managed, undervalued companies. I am in between 4 methods:

1- VanEck MOAT ETF: They choose wide moat, undervalued stocks evaluated by Morningstar updated every quarter. MER 0.46%, it is beating the index last 3-5-10 years by 1%.

2- Buying index ETF such as VOO with low MER (0.03%).

3- Choosing wide moat, exemplary managed, undervalued stocks evaluated by Morningstar myself updating every quarter and making monthly contributions to most undervalued ones. 

4- Same as method 3 but looking at intrinsic values for those stocks myself and bet on the most undervalued ones. For example FICO is undervalued according to Morningstar but according to other sources it is way overvalued.

Which option would you choose and why? Would you recommend another thing?
",https://www.reddit.com/r/stocks/comments/1mgzaym/moat_voo_or_picking_on_my_own/,
1754323295.0,reddit,Is UnitedHealth Group a good stock to buy now?,"With all the leadership changes and last quarter's performance, the stock crazily plummeted to around 240 today. Is it a good time to buy? And will these healthcare insurance provider stocks rebound quickly or even in the future?

I am a newbie to stocks and investments, so pardon my stupid questions.",https://www.reddit.com/r/stocks/comments/1mhhgcs/is_unitedhealth_group_a_good_stock_to_buy_now/,
1754175288.0,reddit,India overtakes China as the world's largest exporters of smartphones,"In Q2 2025, India became the largest source of smartphones shipped to the United States. 

About 44% of U.S. smartphone imports were assembled in India, while China’s share fell to roughly 25% and Vietnam’s was around 30%. 

The shift is driven mainly by Apple moving more iPhone assembly to India, with some contribution from Samsung and Motorola. 

Vendors also front-loaded shipments to the U.S. to hedge against possible tariffs later in 2025. 

Despite the supply-chain shift, total U.S. smartphone shipments grew only about 1% year over year; Apple’s shipments declined around 11% while Samsung’s rose about 38%. ",https://www.reddit.com/r/stocks/comments/1mg3pw2/india_overtakes_china_as_the_worlds_largest/,
1754255737.0,reddit,Stock certificate,"I found a stock certificate issued to my grandfather in 1956.  It was for “oficinas engelke, ca”   This was in Maracaibo Venezuela.  My grandfather worked for Loffland Brothers oil company.   I have googled but no info.  The letter was signed by JW Engelke",https://www.reddit.com/r/stocks/comments/1mgutht/stock_certificate/,
1754317841.0,reddit,Any websites or sources anyone knows of that offer pre-IPO purchasing for non-accredited investors?,"Title says it all. Looking to invest in a couple new companies but trying to find access to buy into them without a $10k minimum. I’ve found em before, but independently mainly and am not having much luck this time around. Any feedback is welcome. I’m also considering that there simply may not be companies without a $10k minimum for investors anymore so if I’m just looking for something that no longer exists, just a heads up would be of help as well lol. Thanks",https://www.reddit.com/r/stocks/comments/1mhf12f/any_websites_or_sources_anyone_knows_of_that/,
1754211475.0,reddit,"If recession is certain, would one divest away from VGT into few individual stocks?","I got about a million dollars in VGT and I’m starting to get worried about looming recession. 

Would it be smart for me to move away from it into few stocks that I believe will perform well in face of economic slowdown over the next 3-5 years, such as GOOG, MSFT, and NVDA?

Much appreciated. ",https://www.reddit.com/r/stocks/comments/1mgek5n/if_recession_is_certain_would_one_divest_away/,
1754155224.0,reddit,Investors are flocking to Figma. Why is the design software maker's stock popular?,"An estimated 95% of Fortune 500 companies use it, with its clients including many tech heavyweights like Amazon (AMZN), Google parent Alphabet (GOOGL), Oracle (ORCL), and Netflix (NFLX).

https://www.investopedia.com/why-investors-are-excited-about-design-software-maker-figma-s-stock-adobe-11783398

August 2025",https://www.reddit.com/r/stocks/comments/1mfw078/investors_are_flocking_to_figma_why_is_the_design/,
1754235196.0,reddit,Atlassian (TEAM) Rovo + Vertical Ecosystem Be Its Moment?,"I’m thinking about whether Atlassian’s AI-powered Rovo, tied to its vertically integrated ecosystem, could spark an “iPod moment” like Apple’s in 2003. Back then, Apple was a niche PC player, and the iPod + iTunes ecosystem made them a consumer titan. Atlassian’s in a similar spot strong with its interconnected suite (Jira, Confluence, Trello, Bitbucket) used by 83% of Fortune 500, but middle-tier against Microsoft, ServiceNow, and GitLab.


Rovo’s an AI platform baked into Atlassian’s tightly knit ecosystem, connecting Jira (dev), Confluence (docs), Trello (tasks), and Bitbucket (code) with third-party tools like Slack and Google Drive. Its unified search pulls contextual data across these tools, Rovo Chat answers queries with company-specific insights, and Rovo Agents automate tasks like backlog cleanup or code reviews. It’s powered by the Teamwork Graph (20+ years of workflow data) and free for Premium/Enterprise users.


Could Rovo’s integration with Atlassian’s vertical system where tools share data and workflows seamlessly be a game changer? It tackles pain points of work time spent searching. Rovo’s no-code agents let teams customize workflows, keeping them in Atlassian’s orbit, much like iTunes locked users into Apple’s ecosystem.


Microsoft’s Copilot and ServiceNow’s AI are tough competitors with bigger ecosystems. And B2B sales cycles are slower than the iPod’s consumer boom. Atlassian’s open integrations, unlike Apple’s walled garden, might limit lock-in. What do you think? Can Rovo make Atlassian the enterprise AI leader, or is it just another feature?
",https://www.reddit.com/r/stocks/comments/1mgm7st/atlassian_team_rovo_vertical_ecosystem_be_its/,
1754072904.0,reddit,CNBC: Trump directs commissioner of labor statistics to be fired,"[Source with info.](https://www.cnbc.com/2025/08/01/trump-erika-mcentarfer-jobs-report-fired.html)

No doubt he'll accuse him of faking the numbers to make him look bad and try to install someone who will only report sunshine and rainbows.

This, obviously, comes after the July report showed only 73K jobs added and dramatic decreases of the May and June reports.

Edit: yup, blaming her for trying to make him look bad.  

> I was just informed that our Country’s “Jobs Numbers” are being produced by a Biden Appointee, Dr. Erika McEntarfer, the Commissioner of Labor Statistics, who faked the Jobs Numbers before the Election to try and boost Kamala’s [Harris’] chances of Victory,” Trump wrote.",https://www.reddit.com/r/stocks/comments/1mf49mh/cnbc_trump_directs_commissioner_of_labor/,
1754145250.0,reddit,Berkshire Hathaway operating earnings dip 4% as conglomerate braces for tariff impact,"
Berkshire Hathaway reported an operating profit of $11.16 billion for the second quarter, down 4% from the same period last year. The drop was largely due to weaker results in its insurance underwriting business. Despite that, other segments including railroads, energy, manufacturing, services, and retail posted higher profits compared to a year ago


EPS down 36% Year Over Year,
Revenue down 1% Year Over Year,
EPS down 23% Quarter Over Quarter,
Revenue up 3% Quarter Over Quarter,

",https://www.reddit.com/r/stocks/comments/1mfs0p4/berkshire_hathaway_operating_earnings_dip_4_as/,
1754184000.0,reddit,What are your favorite institutional-grade investing newsletters/reports/sources of information,"Can be paid or free.
I'm a big fan of Lyn Alden and Darius Dale, in addition to BCA research. I've recently wanted to sub to doomberg and a couple others, but I'm curious to see what better ones am I missing out on",https://www.reddit.com/r/stocks/comments/1mg6ol6/what_are_your_favorite_institutionalgrade/,
1754156672.0,reddit,GOOGL question?,"Y’all,
Google is under investigation from DOJ or EU I think. Not sure if they are still ongoing or what not. If so, does anyone know when they conclude the investigation? I just want to know if they are still being investigated or they already got slapped with fine or penalty. OR, the expected outcome or estimated conclusion by when? I am interested in buying but I would like to know these timelines before getting my feet wet. Thanks!",https://www.reddit.com/r/stocks/comments/1mfwl0i/googl_question/,
1754117744.0,reddit,Microsoft finally revealed Azures true revenue. What do we all think?,"Microsoft used to bundle all kinds of other devices like O365, server licenses, etc. into their “Intelligent Cloud” segment, muddying comparisons with AWS and GCP. Looks like this time, they finally caved and reported numbers. The growth always looked sus to me in the real world given everyone anecdotally swears by AWS and I know very few who use Azures compute or data infrastructures. 

Azure made $75B in the year, apparently growing 34% YoY. GCP is at $50B and AWS is at $111B. AWS has a sizable 32% lead over Microsoft here. 

AWS is also growing 18% and accelerating. But if we assume it stays at say 20% and Azure stays at 35%, it’s catching up by 15% a year. Applying simple compounding, this means Azure will take 3-4 years to reach parity with AWS around the $200B mark. 

Satya is super strategic. Why would he reveal Azure numbers now? Many analysts think it’s because Azure only recently showed that it has a shot of catching AWS due to OpenAI demand. Microsoft is paying openAI which is then paying Microsoft back for using azure compute. 

The future of cloud dominance is all going to come down to openAI carrying Azure growth vs the strength of their combined competitors like Anthropic, llama, Gemini, etc. Anthropic already has better models for some use cases. GPT is also not exclusive to Microsoft and already available on GCP. 

This is not even getting into profitability. We don’t know if Azure is profitable with the AI workloads. Microsoft hasn’t reported those numbers yet. But we do know AWS is printing money and has been even before AI. 

This is going to be an interesting 3 years. I think AI models are increasingly reaching parity. So if there’s no competitive advantage between them, I fully expect AWS to retain and even expand their lead as they simply offer a better product, prices, experience and support. 

 ",https://www.reddit.com/r/stocks/comments/1mfk16k/microsoft_finally_revealed_azures_true_revenue/,
1754173655.0,reddit,What are yalls thoughts on WYFI IPO?,"NEW YORK, July 29, 2025 /PRNewswire/ -- **WhiteFiber, Inc. (""WhiteFiber"" or the ""Company"")**, today announced the launch of its initial public offering of 7,812,500 ordinary shares. The initial public offering price is expected to be between $15.00 and $17.00 per share. In connection with the proposed offering",https://www.reddit.com/r/stocks/comments/1mg34o8/what_are_yalls_thoughts_on_wyfi_ipo/,
1754096837.0,reddit,What’s your biggest ‘I should’ve held’ stock regret?,"You know. Every investor has some kind of regret related to selling too soon such as Apple or Nvidia or anything else. Stock that, if you had just held on, might have changed your life.

What's your ""I sold it too early"" stock and what made you do it? Tell me your story",https://www.reddit.com/r/stocks/comments/1mfdmso/whats_your_biggest_i_shouldve_held_stock_regret/,
1754161874.0,reddit,What do we think of the $FLY IPO,"IPOs and Space especially have been hot. Recently, $VOYG gained 1x on 1st day of trading, $FIG did 3x (and even more after that). I cant help but think that a space name will do the same, but they have been unsuccessful in 4 of their 6 flights and negative earnings (similar to $VOYG tho). And they are IPOing on the back of their lunar landing momentum.

Is an IPO flip worth it here or is this going down the drain?",https://www.reddit.com/r/stocks/comments/1mfymyr/what_do_we_think_of_the_fly_ipo/,
1754245292.0,reddit,Best way to get into stocks as a teenager?,I've had a couple thousand in saving from my summer job and only more will come with 1.5k USD per paycheck approximately. What's a solid introduction that can accommodate my situation as a minor with some free time and money?,https://www.reddit.com/r/stocks/comments/1mgqfcf/best_way_to_get_into_stocks_as_a_teenager/,
1754258799.0,reddit,Is UnitedHealth Once in a lifetime buy?,"I've been keeping an eye on UnitedHealth Group after the dip. With the current valuation and the fact that it's a healthcare giant, it feels like one of those once in a lifetime buy, kind of like buying Apple on a temporary pullback.

But I can't help and think of what happened with PayPal. Tons of people thought it was a no brainer when it dropped under $200, then $100… and now look at it. 

  
Is UNH  different or could this be another case of catching a falling knife in slow motion?",https://www.reddit.com/r/stocks/comments/1mgw1uy/is_unitedhealth_once_in_a_lifetime_buy/,
1754174106.0,reddit,Wash Sale Confusion,"Hi all, I'm seriously confused about the 30 days prior part, regarding the wash sale rule. I see a lot of stuff like this, when I google, or use AI: 

*Adhere strictly to the 30-day rule
Do not repurchase the same security or any ""substantially identical"" security within the 61-day wash sale window. This period includes 30 days before the sale, the day of the sale, and 30 days after the sale.
The safest approach is to avoid repurchasing the exact same stock or security within this window.*

but how the heck do you ""repurchase"" something in the past? The *30 days after* part makes perfect sense to me, just not the 30 days before part. From what I understand, it doesn't matter if I bought shares a year ago, or yesterday--it's still going to trigger a wash sale, if I sell those shares at a loss today, and buy back within the next 30 days...correct? Any clarity appreciated!",https://www.reddit.com/r/stocks/comments/1mg3amk/wash_sale_confusion/,
1754051842.0,reddit,"U.S. added just 73,000 jobs in July and numbers for prior months were revised much lower","https://www.cnbc.com/2025/08/01/jobs-report-july-2025.html

Nonfarm payroll growth was lower than expected in July and the unemployment rate ticked higher, raising potential trouble signs for the U.S. labor market.

Job growth totaled 73,000 for the month, above the June total of 14,000 but below even the meager Dow Jones estimate for a gain of 100,000. June and May totals were revised sharply lower, down by a combined 258,000 from previously announced levels.",https://www.reddit.com/r/stocks/comments/1mevctp/us_added_just_73000_jobs_in_july_and_numbers_for/,
1754072932.0,reddit,"Tesla must pay $329 million in damages in fatal Autopilot case, jury says","A jury in Miami has determined that Tesla should be held partly liable for a fatal 2019 Autopilot crash, and must compensate the family of the deceased and an injured survivor damages of $329 million.

The payout includes $129 million in compensatory damages, and $200 million in punitive damages against Tesla. Attorneys for the plaintiffs had asked the jury to award damages of around $345 million. The trial in the Southern District of Florida started on July 14.

The suit centered around who shouldered the blame for the deadly crash in Key Largo, Florida. A Tesla owner named George McGee was driving his Model S electric sedan while using the company’s Enhanced Autopilot, a partially automated driving system.

While driving, McGee dropped his mobile phone that he was using and scrambled to pick it up. He said during the trial that he believed Enhanced Autopilot would brake if an obstacle was in the way. His Model S accelerated through an intersection at just over 60 miles per hour, hitting a nearby empty parked car and its owners, who were standing on the other side of their vehicle.

Naibel Benavides, who was 22, died on the scene from injuries sustained in the crash. Her body was discovered about 75 feet away from the point of impact. Her boyfriend, Dillon Angulo, survived but suffered multiple broken bones, a traumatic brain injury and psychological effects.

Source: [https://www.cnbc.com/2025/08/01/tesla-must-pay-329-million-in-damages-in-fatal-autopilot-case.html](https://www.cnbc.com/2025/08/01/tesla-must-pay-329-million-in-damages-in-fatal-autopilot-case.html)",https://www.reddit.com/r/stocks/comments/1mf4a1y/tesla_must_pay_329_million_in_damages_in_fatal/,
1754054595.0,reddit,"Market sinks as Trump announces slew of new tariffs, including 50% on Brazil, as US job market slows","This is the full new tariff list, in descending order:

**50%**

* Brazil

**41%**

* Syria

**40%**

* Laos
* Myanmar

**39%**

* Switzerland

**35%**

* Canada *(goods not exempted by USMCA)*
* Iraq
* Serbia

**30%**

* Algeria
* Bosnia and Herzegovina
* China *(most goods; some exemptions)*
* Libya
* South Africa

**25%**

* Brunei
* India
* Kazakhstan
* Mexico *(goods not exempted by USMCA)*
* Moldova
* Tunisia

**20%**

* Bangladesh
* Sri Lanka
* Taiwan
* Vietnam

**19%**

* Cambodia
* Indonesia
* Malaysia
* Pakistan
* Philippines
* Thailand

**18%**

* Nicaragua

**15%**  
Afghanistan; Angola; Bolivia; Botswana; Cameroon; Chad; Costa Rica; Ivory Coast; DR Congo; Ecuador; Equatorial Guinea; **European Union (on most goods);** Fiji; Ghana; Guyana; Iceland; Israel; Japan; Jordan; Lesotho; Liechtenstein; Madagascar; Malawi; Mauritius; Mozambique; Namibia; Nauru; New Zealand; Nigeria; North Macedonia; Norway; Papua New Guinea; South Korea; Trinidad and Tobago; Turkey; Uganda; Vanuatu; Venezuela; Zambia; Zimbabwe.

**10% (all other countries)**

* All other countries.

The US job market also slowed substantially in July and was much weaker than previously thought in previous months:

The US economy added just 73,000 jobs last month, and the monthly totals for May and June were revised down by 258,000 jobs, to 19,000 and 14,000, respectively.

Amazon is also down a fresh 7% as they had a pretty terrible earnings call.",https://www.reddit.com/r/stocks/comments/1mewdtd/market_sinks_as_trump_announces_slew_of_new/,
1754294489.0,reddit,"Daily General Discussion and Advice Thread - August 04, 2025","Have a general question? Want to offer some commentary on markets? Maybe you would just like to throw out a neat fact that doesn't warrant a self post? Feel free to post here!

Please consider consulting our FAQ first - [https://www.reddit.com/r/investing/wiki/faq](https://www.reddit.com/r/investing/wiki/faq) And our [side bar](https://www.reddit.com/r/investing/about/sidebar) also has useful resources.

If you are new to investing - please refer to Wiki - [Getting Started](https://www.reddit.com/r/investing/wiki/index/gettingstarted/)

The reading list in the wiki has a list of books ranging from light reading to advanced topics depending on your knowledge level. Link here - [Reading List](https://www.reddit.com/r/investing/wiki/readinglist)

The media list in the wiki has a list of reputable podcasts and videos - [Podcasts and Videos](https://www.reddit.com/r/investing/wiki/medialist)

If your question is ""I have $XXXXXXX, what do I do?"" or other ""advice for my personal situation"" questions, you should include relevant information, such as the following:

* How old are you? What country do you live in?
* Are you employed/making income? How much?
* What are your objectives with this money? (Buy a house? Retirement savings?)
* What is your time horizon? Do you need this money next month? Next 20yrs?
* What is your risk tolerance? (Do you mind risking it at blackjack or do you need to know its 100% safe?)
* What are you current holdings? (Do you already have exposure to specific funds and sectors? Any other assets?)
* Any big debts (include interest rate) or expenses?
* And any other relevant financial information will be useful to give you a proper answer.

Check the resources in the sidebar.

Be aware that these answers are just opinions of Redditors and should be used as a starting point for your research. You should strongly consider seeing a registered investment adviser if you need professional support before making any financial decisions!",https://www.reddit.com/r/investing/comments/1mh7hb8/daily_general_discussion_and_advice_thread_august/,
